b'34214.',b'19-Dec-2020 12:00 AM',b'15-Jul-2020 02:00 PM',"b'P/L interlocking tile in Hakiman Wali Gali, Sh. Darbar Sahib Gate No. 3 AND 5 Streets and links W.No. 11/ LG/MC/Sri Muktsar Sahib/2020/06 / 2020_DLG_50541_13'",b'Punjab',b'2020_DLG_50541_13'
b'34215.',b'30-Dec-2020 12:00 AM',b'15-Jul-2020 02:00 PM',"b'P/L interlocking tile in Kotli road Gali No. 2, 3, 5, 6, 7 W.No. 28/ LG/MC/Sri Muktsar Sahib/2020/06 / 2020_DLG_50541_23'",b'Punjab',b'2020_DLG_50541_23'
b'34216.',b'30-Dec-2020 12:00 AM',b'15-Jul-2020 02:00 PM',b'P/L interlocking tile in Dr. Darshan Wali Gali W.No. 28/ LG/MC/Sri Muktsar Sahib/2020/06 / 2020_DLG_50541_22',b'Punjab',b'2020_DLG_50541_22'
b'34217.',b'20-Aug-2020 12:00 AM',b'15-Jul-2020 02:00 PM',b'Constructing Kitchen Shed For School At Warwandi Tal Dindori Dist Nashik/ VP/GP/WORK/2020-21/3-4 / 2020_NASHI_594758_2',b'Maharashtra',b'2020_NASHI_594758_2'
b'34218.',b'04-Aug-2020 12:00 AM',b'15-Jul-2020 02:00 PM',"b'Supply and installation of Fabrication, Modular Workstation and Other Furniture at  ILGUS BHAVAN/ 134/MA/AMRUT/R-31/2019 / 2020_MAD_289703_1'",b'West Bengal',b'2020_MAD_289703_1'
b'34219.',b'27-Jul-2020 12:00 AM',b'15-Jul-2020 01:45 PM',b'Constructon of School Class Room In Z.P. Marathi Primary School At. Wakad Jh.  G.P. Keshav Shivni Tq S.Raja Dist. Buldhana/ 01_2019/2020 / 2020_BULDH_594768_2',b'Maharashtra',b'2020_BULDH_594768_2'
b'34220.',b'27-Jul-2020 12:00 AM',b'15-Jul-2020 01:40 PM',"b'Construction Of Compound Wall For ZP School Building At Village Kalkheda,Tal.Dhule,Dist.Dhule/ GP/KALKHEDA/10/2020-21 / 2020_DHULE_594762_1'",b'Maharashtra',b'2020_DHULE_594762_1'
b'34201.',b'19-Dec-2020 12:00 AM',b'15-Jul-2020 02:00 PM',b'P/L interlocking tile and Re-laying in various areas W.No. 8/ LG/MC/Sri Muktsar Sahib/2020/06 / 2020_DLG_50541_11',b'Punjab',b'2020_DLG_50541_11'
b'34202.',b'19-Dec-2020 12:00 AM',b'15-Jul-2020 02:00 PM',b'P/L interlocking tile in Nursury School Wali Gali and links W.No. 12/ LG/MC/Sri Muktsar Sahib/2020/06 / 2020_DLG_50541_14',b'Punjab',b'2020_DLG_50541_14'
b'34203.',b'26-Sep-2020 12:00 AM',b'15-Jul-2020 02:00 PM',b'100 Nos. Resistivity Survey Work in BARWANI&amp;#x0d;\nDISTRICT/ 07 / 2020_PHED_97037_1',b'Madhya Pradesh',b'2020_PHED_97037_1'
b'34204.',b'19-Dec-2020 12:00 AM',b'15-Jul-2020 02:00 PM',"b'P/L interlocking tile Namdev Nagar, Dashmesh Nagar and Ekta complex W.No. 7/ LG/MC/Sri Muktsar Sahib/2020/06 / 2020_DLG_50541_10'",b'Punjab',b'2020_DLG_50541_10'
b'34205.',b'30-Dec-2020 12:00 AM',b'15-Jul-2020 02:00 PM',b'P/L interlocking tile in Baba Jiwan Singh Nagar streets W.No. 25/ LG/MC/Sri Muktsar Sahib/2020/06 / 2020_DLG_50541_20',b'Punjab',b'2020_DLG_50541_20'
b'34206.',b'19-Dec-2020 12:00 AM',b'15-Jul-2020 02:00 PM',b'P/L interlocking tile surgapuri and Baba Farid Nagar st. no. 1 links W.No. 8/ LG/MC/Sri Muktsar Sahib/2020/06 / 2020_DLG_50541_12',b'Punjab',b'2020_DLG_50541_12'
b'34207.',b'30-Dec-2020 12:00 AM',b'15-Jul-2020 02:00 PM',b'P/L interlocking tile in Guruharsahai road link streets W.No. 25/ LG/MC/Sri Muktsar Sahib/2020/06 / 2020_DLG_50541_21',b'Punjab',b'2020_DLG_50541_21'
b'34208.',b'19-Dec-2020 12:00 AM',b'15-Jul-2020 02:00 PM',"b'P/L interlocking tile in Hakiman Wali Gali, Sh. Darbar Sahib Gate No. 3 AND 5 Streets and links W.No. 11/ LG/MC/Sri Muktsar Sahib/2020/06 / 2020_DLG_50541_13'",b'Punjab',b'2020_DLG_50541_13'
b'34209.',b'27-Sep-2020 12:00 AM',b'15-Jul-2020 02:00 PM',b'100 Nos. Resistivity Survey Work in KHANDWA&amp;#x0d;\nDISTRICT/ 05 / 2020_PHED_97034_1',b'Madhya Pradesh',b'2020_PHED_97034_1'
b'34210.',b'10-Aug-2020 12:00 AM',b'15-Jul-2020 02:00 PM',"b'WE NEED AVEHICLE, DOCTOR, NURSE, DMLT,DRIVER AND MEDICINES/ DPMSU-IDKI/1246/PRO/2020/DPMSU / 2020_DHS_371540_1'",b'Kerala',b'2020_DHS_371540_1'
b'34191.',b'17-Jul-2020 12:00 AM',b'15-Jul-2020 02:00 PM',b'SALE OF SUGAR/ NKD/Sugar Sale/49 / 2020_Coop_50613_1',b'Punjab',b'2020_Coop_50613_1'
b'34192.',b'30-Dec-2020 12:00 AM',b'15-Jul-2020 02:00 PM',b'P/L interlocking tile in Guruharsahai road link streets W.No. 25/ LG/MC/Sri Muktsar Sahib/2020/06 / 2020_DLG_50541_21',b'Punjab',b'2020_DLG_50541_21'
b'34193.',b'25-Sep-2020 12:00 AM',b'15-Jul-2020 02:00 PM',b'SUGAR TRANSPORTATION UJJAIN TO BHURANPUR TENDER/ PUR/SUGAR TRANSPORATOPN UJJAINTENDER DATE 14-07-20 / 2020_MPCDF_97957_1',b'Madhya Pradesh',b'2020_MPCDF_97957_1'
b'34194.',b'19-Dec-2020 12:00 AM',b'15-Jul-2020 02:00 PM',b'P/L interlocking tile in Kotli Road W.No. 1/ LG/MC/Sri Muktsar Sahib/2020/06 / 2020_DLG_50541_7',b'Punjab',b'2020_DLG_50541_7'
b'34195.',b'14-Aug-2020 12:00 AM',b'15-Jul-2020 02:00 PM',"b'4.Construction compound wall and Kitchen room ,WC Unit for ZP School Building Bhadalewasti Ward No.1 at Wagholi Tal Haveli Dist Pune/ GPW/E-TENDER/2020-21/2_2 / 2020_RDPUN_594708_4'",b'Maharashtra',b'2020_RDPUN_594708_4'
b'34196.',b'19-Dec-2020 12:00 AM',b'15-Jul-2020 02:00 PM',"b'P/L interlocking tile Namdev Nagar, Dashmesh Nagar and Ekta complex W.No. 7/ LG/MC/Sri Muktsar Sahib/2020/06 / 2020_DLG_50541_10'",b'Punjab',b'2020_DLG_50541_10'
b'34197.',b'11-Sep-2020 12:00 AM',b'15-Jul-2020 02:00 PM',"b'Annual Mace. 2020 - Leak rectification works of pipe line for RWSS to Chenneerkara Mezhuveli, Omalloor Thottathil Bhagom, Kulanada, WSS to Punnakunnu and Mezhuveli HC/ 213/2019-20/EE/PH/PTA / 2020_KWA_352138_2'",b'Kerala',b'2020_KWA_352138_2'
b'34198.',b'19-Dec-2020 12:00 AM',b'15-Jul-2020 02:00 PM',b'P/L interlocking tile and Re-laying in various areas W.No. 8/ LG/MC/Sri Muktsar Sahib/2020/06 / 2020_DLG_50541_11',b'Punjab',b'2020_DLG_50541_11'
b'34199.',b'30-Dec-2020 12:00 AM',b'15-Jul-2020 02:00 PM',b'P/L interlocking tile in various street W.No. 24/ LG/MC/Sri Muktsar Sahib/2020/06 / 2020_DLG_50541_19',b'Punjab',b'2020_DLG_50541_19'
b'34200.',b'14-Aug-2020 12:00 AM',b'15-Jul-2020 02:00 PM',b'3.Construction of WC Unit at Z P School Building at Wagholi Tal Haveli Dist Pune/ GPW/E-TENDER/2020-21/2_2 / 2020_RDPUN_594708_3',b'Maharashtra',b'2020_RDPUN_594708_3'
b'34181.',b'30-Dec-2020 12:00 AM',b'15-Jul-2020 02:30 PM',"b'FURNISHING WORK FOR  100 BEDDED HOSPITAL AT PT. DEEN DAYAL UPADHYAY GOVT. CORONATION HOSPITAL, DEHRADUN/ 1550/Nivida(Garhwal)/255 Dated 14/07/2020 / 2020_MDPEY_24983_1'",b'Uttarakhand',b'2020_MDPEY_24983_1'
b'34182.',b'01-Aug-2020 12:00 AM',b'15-Jul-2020 02:20 PM',"b'Proviing Paver Block in Ramabai Nagar At Village Dhadara,Tal.Dhule,Dist.Dhule/ GP/DHDARA/04/2020-21 / 2020_DHULE_594787_1'",b'Maharashtra',b'2020_DHULE_594787_1'
b'34183.',b'27-Jul-2020 12:00 AM',b'15-Jul-2020 02:00 PM',b'Construction of Sabhagruha At Village Khamgaon Gramin Tq Khamgaon Dist Buldhana/ ETENDER NOTICE 01/2020-21 / 2020_BULDH_594730_1',b'Maharashtra',b'2020_BULDH_594730_1'
b'34184.',b'10-Aug-2020 12:00 AM',b'15-Jul-2020 02:00 PM',"b'WE NEED AVEHICLE, DOCTOR, NURSE, DMLT,DRIVER AND MEDICINES/ DPMSU-IDKI/1246/PRO/2020/DPMSU / 2020_DHS_371540_1'",b'Kerala',b'2020_DHS_371540_1'
b'34185.',b'04-Aug-2020 12:00 AM',b'15-Jul-2020 02:00 PM',"b'Supply and installation of Fabrication, Modular Workstation and Other Furniture at  ILGUS BHAVAN/ 134/MA/AMRUT/R-31/2019 / 2020_MAD_289703_1'",b'West Bengal',b'2020_MAD_289703_1'
b'34186.',b'30-Dec-2020 12:00 AM',b'15-Jul-2020 02:00 PM',"b'P/L interlocking tile in Kotli road Gali No. 2, 3, 5, 6, 7 W.No. 28/ LG/MC/Sri Muktsar Sahib/2020/06 / 2020_DLG_50541_23'",b'Punjab',b'2020_DLG_50541_23'
b'34187.',b'30-Dec-2020 12:00 AM',b'15-Jul-2020 02:00 PM',b'P/L interlocking tile in Dr. Darshan Wali Gali W.No. 28/ LG/MC/Sri Muktsar Sahib/2020/06 / 2020_DLG_50541_22',b'Punjab',b'2020_DLG_50541_22'
b'34188.',b'30-Dec-2020 12:00 AM',b'15-Jul-2020 02:00 PM',b'P/L interlocking tile in Baba Jiwan Singh Nagar streets W.No. 25/ LG/MC/Sri Muktsar Sahib/2020/06 / 2020_DLG_50541_20',b'Punjab',b'2020_DLG_50541_20'
b'34189.',b'25-Sep-2020 12:00 AM',b'15-Jul-2020 02:00 PM',b'SUGAR TRANSPORTATION UJJAIN TO BHURANPUR TENDER/ PUR/SUGAR TRANSPORATOPN UJJAINTENDER DATE 14-07-20 / 2020_MPCDF_97957_1',b'Madhya Pradesh',b'2020_MPCDF_97957_1'
b'34190.',b'09-Sep-2020 12:00 AM',b'15-Jul-2020 02:00 PM',b'Providing and Laying of 4 inch dia AC Water supply Line at Satnam Nagar/ MCJ/OM/2020/30B / 2020_DLG_50296_4',b'Punjab',b'2020_DLG_50296_4'
b'34171.',b'26-Nov-2020 12:00 AM',b'15-Jul-2020 03:00 PM',"b'Construction of 15,000 Gallon capacity RCC ground level reservoir with pump house including laying of pipeline, providing and Installation of pump motor set etc. at Khamar para DWS Sub-Division, Rupaichari during the year 2020-21./ 04/DNIeT/SE/DWSC/UDP/2020-21 / 2020_CEDWS_11358_1'",b'Tripura',b'2020_CEDWS_11358_1'
b'34172.',b'30-Sep-2020 12:00 AM',b'15-Jul-2020 03:00 PM',b'Special Repair Of Road From Village Baroda To Kohla  . In Baroda  Constituency  Distt. Sonepat Road Id 2617/ HSAMB SONEPAT 2020 / 2020_HBC_135758_1',b'Haryana',b'2020_HBC_135758_1'
b'34173.',b'07-Nov-2020 12:00 AM',b'15-Jul-2020 03:00 PM',"b'To resolve complaints received from CM and MAYOR HELPLINE, repair damaged pipe, chamber and provide cover on them at zone 16 ward 15./ 09/EE/WWD/20-21/E-TENDER-G-29 / 2020_UAD_97259_1'",b'Madhya Pradesh',b'2020_UAD_97259_1'
b'34174.',b'19-Oct-2020 12:00 AM',b'15-Jul-2020 03:00 PM',"b'Construction  of 03 nos  SBDTW with storage tank, Laying of  various dia Pipe Lines, Installation of Submersible Pump Motor set including other allied works under Bokafa Block during the year 2020-21./ 42/DNIeT/EE/DWS/BLN/2020-21 / 2020_CEDWS_11367_1'",b'Tripura',b'2020_CEDWS_11367_1'
b'34175.',b'09-Sep-2020 12:00 AM',b'15-Jul-2020 03:00 PM',b'AUGMENTATION OF WATER SUPPLY SCHEME RAIPUR GUJJRAN MH FC FROM HANDPUMP BLOCK MEHATPUR DISTT JALANDHAR UNDER PRWSSIP 1Aiii JJM PROJECT/ RAIPUR GUJJRAN 1A(III) 2020 DWSS-W-DIV79-8113-1 / 2020_WB_48530_2',b'Punjab',b'2020_WB_48530_2'
b'34176.',b'17-Aug-2020 12:00 AM',b'15-Jul-2020 03:00 PM',"b'Grass/Bush Cutting Work in Non-Operational Area at Dr. Babasaheb Ambedkar International Airport, Nagpur (2020-2021)/ CE-2021-P / 2020_MADC_594777_1'",b'Maharashtra',b'2020_MADC_594777_1'
b'34177.',b'01-Dec-2020 12:00 AM',b'15-Jul-2020 02:50 PM',b'Online tender for supply of Centrifugally Cast   Ductile Iron K7 and  K9 class pressure pipes both 100 mm dia. to 1200 mm dia. conforming to Indian Standard Specification No IS 8329 2000/ e-TENDER NOTICE NO.1  FOR YEAR 2020-21 / 2020_COJAL_594599_1',b'Maharashtra',b'2020_COJAL_594599_1'
b'34178.',b'27-Sep-2020 12:00 AM',b'15-Jul-2020 02:45 PM',b'100 NOS Handpump installation and platform construction in Hard Murram soils area Distt. INDORE/ 09 / 2020_PHED_97041_1',b'Madhya Pradesh',b'2020_PHED_97041_1'
b'34179.',b'28-Jul-2020 10:56 AM',b'15-Jul-2020 02:31 PM',b'Providing of New Centre Lights from Reddy Labs to Ullas Dhabha in Nizampet Municipal Corporation under LRS funds./ E1/7488/26/2020-21 / 185334',b'Telegana',b'185334'
b'34180.',b'04-Aug-2020 12:00 AM',b'15-Jul-2020 02:30 PM',"b'Supply and Installation of  Networking, Air-conditioning , Electrical Works, Aluminum Partition for SmartRack Room, Supply and Fixation of Window Blinds, Painting and decoration Work in Bundle.at  ILGUS BHAVAN/ 135/MA/AMRUT/R-31/2019 / 2020_MAD_289712_1'",b'West Bengal',b'2020_MAD_289712_1'
b'34161.',b'28-Sep-2020 12:00 AM',b'15-Jul-2020 03:00 PM',b'Proposed Construction of Residencial Building at Gut No. at Uday Nagar Lohgoan Road Parbhani/ No.WS.CE.Pw.217.20 Dtd. 15.07.2020 / 2020_PCMC_594791_1',b'Maharashtra',b'2020_PCMC_594791_1'
b'34162.',b'30-Sep-2020 12:00 AM',b'15-Jul-2020 03:00 PM',b'Special Repair Of Road From Village Baroda To Kohla  . In Baroda  Constituency  Distt. Sonepat Road Id 2617/ HSAMB SONEPAT 2020 / 2020_HBC_135758_1',b'Haryana',b'2020_HBC_135758_1'
b'34163.',b'09-Sep-2020 12:00 AM',b'15-Jul-2020 03:00 PM',b'AUGMENTATION OF WATER SUPPLY SCHEME MOTIPUR 2 No MH FC  FROM HANDPUMP BLOCK LOHIAN DISTT JALANDHAR UNDER PRWSSIP 1Aiii JJM PROJECT/ MOTIPUR 1A(III) 2020 PRWSS-W-DIV79-7872-1 / 2020_WB_48522_2',b'Punjab',b'2020_WB_48522_2'
b'34164.',b'26-Nov-2020 12:00 AM',b'15-Jul-2020 03:00 PM',"b'Construction of 15,000 Gallon capacity RCC ground level reservoir with pump house including laying of pipeline, providing and Installation of pump motor set etc. at Khamar para DWS Sub-Division, Rupaichari during the year 2020-21./ 04/DNIeT/SE/DWSC/UDP/2020-21 / 2020_CEDWS_11358_1'",b'Tripura',b'2020_CEDWS_11358_1'
b'34165.',b'18-Sep-2020 12:00 AM',b'15-Jul-2020 03:00 PM',"b'Milk Collection and Milk Transportation Tender VI Call At Bundelkhand sahakari dugdha sangh mydt, sironja Sagar/ 208/BKDS/FO/2020 / 2020_MPCDF_97974_1'",b'Madhya Pradesh',b'2020_MPCDF_97974_1'
b'34166.',b'07-Sep-2020 12:00 AM',b'15-Jul-2020 03:00 PM',b'AUGMENTATION OF WATER SUPPLY SCHEME GOBIND NAGAR MH FC FROM HANDPUMP BLOCK MEHATPUR DISTT JALANDHAR UNDER PRWSSIP 1A iii JJM PROJECT/ GOBIND NAGAR 1A iii JJM DWSS-W-DIV79-8200-1 2020 / 2020_WB_49578_2',b'Punjab',b'2020_WB_49578_2'
b'34167.',b'17-Sep-2020 12:00 AM',b'15-Jul-2020 03:00 PM',b'SUPPLY OF FOTS/ TELK/PUR/MRM/20/34436 / 2020_TEKL_371898_1',b'Kerala',b'2020_TEKL_371898_1'
b'34168.',b'21-Aug-2020 12:00 AM',b'15-Jul-2020 03:00 PM',"b'Renovation of Guest House in Sector 48 of GMCH, Sector 32, Chandigarh./ EECP5/2020/1115-30 dated 15.07.2020 / 2020_CHD_56073_1'",b'Chandigarh UT',b'2020_CHD_56073_1'
b'34169.',b'15-Dec-2020 12:00 AM',b'15-Jul-2020 03:00 PM',b'Repairing and Rewinding of different capacities V.T. Pump and Motor of 0.65 MGD of SWTP at Santirbazar under DWS Sub-Division Santirbazar during the year 2020-21 (2nd Call)./ 05/DNIeT/EE/DWS/BLN/20-21(2nd Call) / 2020_CEDWS_11362_1',b'Tripura',b'2020_CEDWS_11362_1'
b'34170.',b'15-Dec-2020 12:00 AM',b'15-Jul-2020 03:00 PM',b'Rewinding of various make Burnt Motor at different DTW Scheme under Rajnagar and B.C. Nagar Block during the year 2020-21./ 41/DNIeT/EE/DWS/BLN/2020-21 / 2020_CEDWS_11365_1',b'Tripura',b'2020_CEDWS_11365_1'
b'34141.',b'27-Jul-2020 12:00 AM',b'15-Jul-2020 04:00 PM',b'Construction of Concrete road from house of dinkar kankhar to shivaji kankhar house in ward no 3 Village  Mendgaon Tq. Deulgaon Raja Dist. Buldhana/ E-TENDER/01/20-21 / 2020_BULDH_594832_1',b'Maharashtra',b'2020_BULDH_594832_1'
b'34142.',b'27-Jul-2020 12:00 AM',b'15-Jul-2020 04:00 PM',b'Construction of Shmashanbhumi shed at Village  Mendgaon Tq. Deulgaon Raja Dist. Buldhana/ E-TENDER/01/20-21 / 2020_BULDH_594832_2',b'Maharashtra',b'2020_BULDH_594832_2'
b'34143.',b'03-Sep-2020 12:00 AM',b'15-Jul-2020 04:00 PM',b'Const Village cement cocnrete road at dhandri tal satana/ bnc2 tn5 wo 5 dhandri drba / 2020_NASHI_594583_1',b'Maharashtra',b'2020_NASHI_594583_1'
b'34144.',b'07-Aug-2020 12:00 AM',b'15-Jul-2020 04:00 PM',b'Emergent Restoration of Khud Side near Post Office at Teesta Bazar of T.V.  Road under Kalimpong  Sub Division- I of Kalimpong Divison PWD/ WBPWD/EE/KPG/NIT_04/2020-21 / 2020_WBPWD_289713_1',b'West Bengal',b'2020_WBPWD_289713_1'
b'34145.',b'01-Oct-2020 12:00 AM',b'15-Jul-2020 04:00 PM',b'Annual rate contract for Rewinding of LT Motors under scope of EMD II division of 2X500 MW DTPS Anpara/ 05/EMDII/DTPS/2020-21 / 2020_RVUNL_492983_1',b'Uttar Pradesh',b'2020_RVUNL_492983_1'
b'34146.',b'28-Aug-2020 12:00 AM',b'15-Jul-2020 04:00 PM',"b'Construction of 1 No. H/L Bridge (2 Spans) 8.37 M Normal and 11.727 mtr avg. skew c/c each at RD 1755 on Tandi to Masol road including its approaches, and other balance works of 3 No Bridges at RD 330, RD 1260, RD 2610 and Vented Causeway in Distt. M/ Bid no.7 Dt. 14/07/2020 / 2020_CEPW_50582_1'",b'Punjab',b'2020_CEPW_50582_1'
b'34147.',b'30-Jul-2020 12:00 AM',b'15-Jul-2020 04:00 PM',"b'Pumping scheme  at Thodupuzha Muncipality ,Panchayath office compound Muttom, ward-31,  and Homeo Hospital Muttom  in Idukki Dt/ 06/2020-2021 / 2020_GWD_371867_1'",b'Kerala',b'2020_GWD_371867_1'
b'34148.',b'31-Aug-2020 12:00 AM',b'15-Jul-2020 04:00 PM',b'Providing Haydrulic Tipping Trailer for Wastage collection At- Padali Station Tal- Koregaon Dist- Satara./ PAD/8/2019-20/2 / 2020_SATAR_594833_1',b'Maharashtra',b'2020_SATAR_594833_1'
b'34149.',b'03-Sep-2020 12:00 AM',b'15-Jul-2020 04:00 PM',b'Const Village cement cocnrete road at bramhangaon tal satana/ bnc2 tn5 wo 4  drba / 2020_NASHI_594581_1',b'Maharashtra',b'2020_NASHI_594581_1'
b'34150.',b'27-Jul-2020 12:00 AM',b'15-Jul-2020 04:00 PM',b'Constructing Under Ground PVC Pipe Gutter At village Nagaon (R.N Patil To Ambadas Vadar Etc)Tal Dhule and Dist Dhule/ GP/NAGAON/16/2020 / 2020_DHULE_594839_1',b'Maharashtra',b'2020_DHULE_594839_1'
b'34131.',b'17-Nov-2020 12:00 AM',b'15-Jul-2020 04:40 PM',b'Raising water logged area and Renewal BT/ PWD/2020-2021/14551/RdDnKNR / 2020_PWD_371941_1',b'Kerala',b'2020_PWD_371941_1'
b'34132.',b'21-Jul-2020 04:31 PM',b'15-Jul-2020 04:32 PM',"b'Laying of VDCC road with M30 grade in place of damaged BT road from Plot No.1299 to Plot No.1317 at Road No.66 Jubilee Hills, Cir No.18 (CZ) GHMC (Item No.2)/ 19/EE/CIR-18/KZ/GHMC/2020-21,Dt: 14-07-2020 (Item No.2) / 185393'",b'Telegana',b'185393'
b'34133.',b'03-Aug-2020 12:00 AM',b'15-Jul-2020 04:30 PM',b'Const of Urinal and WC for Z.P school at jambud Tal.Malshiras/ ET/05/2020 / 2020_SOLAP_594840_1',b'Maharashtra',b'2020_SOLAP_594840_1'
b'34134.',b'29-Jul-2020 12:00 AM',b'15-Jul-2020 04:30 PM',b'Providing And Fixing Paver Block In Dalit Vasti At Village Henkalwadi Tal And Dist Dhule/ GP/HENKALWADI/07/2020-21 / 2020_DHULE_594855_1',b'Maharashtra',b'2020_DHULE_594855_1'
b'34135.',b'21-Jul-2020 04:29 PM',b'15-Jul-2020 04:24 PM',"b'Removal of water stagnation by laying of 600mm dia RCC NP3 pipe line from Plot No.1001 to Plot No.978/A Road No.49 Jubilee Hills, Cir No.18 (CZ) GHMC (Item No.1)/ 19/EE/CIR-18/KZ/GHMC/2020-21,Dt: 14-07-2020 (Item No.1) / 185386'",b'Telegana',b'185386'
b'34136.',b'27-Jul-2020 12:00 AM',b'15-Jul-2020 04:20 PM',b'Constructing Under Ground PVC Pipe Gutter At village Nagaon (Suresh Sampat To Sahebrav Saindane)Tal Dhule and Dist Dhule/ GP/NAGAON/17/2020 / 2020_DHULE_594849_1',b'Maharashtra',b'2020_DHULE_594849_1'
b'34137.',b'07-Aug-2020 12:00 AM',b'15-Jul-2020 04:15 PM',"b'Construction of Primary Health Center at Daudnagar, District-Lucknow (U.P)/ 03/E-Nivida/LucknowIII/2020-21 / 2020_UPRNS_479174_3'",b'Uttar Pradesh',b'2020_UPRNS_479174_3'
b'34138.',b'09-Nov-2020 12:00 AM',b'15-Jul-2020 04:15 PM',"b'Providing and Installing deep tubewell 200 mm i/d straight 150 mtr depth with 15 mtr stainless strainer with hand boring, Pumping machinery, Chlorinator, const. Pump Chamber with WC Gravel Pit, Construction of one No. OHSR 50 KL with 3 Month O and M/ Village Mianpur Under Nabard XXIII / 2020_WSS_50304_1'",b'Punjab',b'2020_WSS_50304_1'
b'34139.',b'03-Sep-2020 12:00 AM',b'15-Jul-2020 04:00 PM',b'Const Village cement cocnrete road at dhandri tal satana/ bnc2 tn5 wo 5 dhandri drba / 2020_NASHI_594583_1',b'Maharashtra',b'2020_NASHI_594583_1'
b'34140.',b'30-Jul-2020 12:00 AM',b'15-Jul-2020 04:00 PM',"b'Pumping scheme  at Thodupuzha Muncipality ,Panchayath office compound Muttom, ward-31,  and Homeo Hospital Muttom  in Idukki Dt/ 06/2020-2021 / 2020_GWD_371867_1'",b'Kerala',b'2020_GWD_371867_1'
b'34111.',b'23-Oct-2020 12:00 AM',b'15-Jul-2020 05:00 PM',b'Please refer tender docuemnts/ e-15/EE/LSGD/2020-21 / 2020_LSGD_371826_16',b'Kerala',b'2020_LSGD_371826_16'
b'34112.',b'27-Nov-2020 12:00 AM',b'15-Jul-2020 05:00 PM',b'Retender RIDF XXV- Reviving Rice Farming in Fallow lands of Chengannur LAC - Augmenting Irrigation and Drainage Facility Establishing Lift Irrigation Scheme in  Attakkuzhy   Padasekharams  in Thiruvanvandoor Gramapanchayath/ EE (2) 392/2020 / 2020_AGRI_358268_3',b'Kerala',b'2020_AGRI_358268_3'
b'34113.',b'25-Sep-2020 12:00 AM',b'15-Jul-2020 05:00 PM',b'AR OF LR IN MOHINDERGARH CONSTITUENCY GROUP-III IN DISTT MOHINDERGARH/ AR OF LR IN MOHINDERGARH CONSTITUENCY G-III / 2020_HBC_135777_1',b'Haryana',b'2020_HBC_135777_1'
b'34114.',b'23-Oct-2020 12:00 AM',b'15-Jul-2020 05:00 PM',b'Please refer tender docuemnts/ e-15/EE/LSGD/2020-21 / 2020_LSGD_371826_14',b'Kerala',b'2020_LSGD_371826_14'
b'34115.',b'25-Sep-2020 12:00 AM',b'15-Jul-2020 05:00 PM',b'AR OF LR IN MOHINDERGARH CONSTITUENCY GROUP-II IN DISTT MOHINDERGARH/ AR OF LR IN MOHINDERGARH CONSTITUENCY G-II / 2020_HBC_135772_1',b'Haryana',b'2020_HBC_135772_1'
b'34116.',b'25-Sep-2020 12:00 AM',b'15-Jul-2020 05:00 PM',b'AR OF LR IN MOHINDERGARH CONSTITUENCY GROUP-I IN DISTT MOHINDERGARH/ AR OF LR IN MOHINDERGARH CONSTITUENCY G-I / 2020_HBC_135763_1',b'Haryana',b'2020_HBC_135763_1'
b'34117.',b'10-Nov-2020 12:00 AM',b'15-Jul-2020 05:00 PM',"b'Construction of pump house, providing and installation of pump sets, providing and laying of distribution pipe line, providing domestic connection etc/ 189/EE/DWS/DMN/2020-21 / 2020_CEDWS_11347_1'",b'Tripura',b'2020_CEDWS_11347_1'
b'34118.',b'06-Nov-2020 12:00 AM',b'15-Jul-2020 05:00 PM',"b'Construction of pump house, providing and installation of pump sets, providing and laying of distribution pipe line, providing domestic connection etc/ 185/EE/DWS/DMN/2020-21 / 2020_CEDWS_11343_1'",b'Tripura',b'2020_CEDWS_11343_1'
b'34119.',b'06-Aug-2020 12:00 AM',b'15-Jul-2020 05:00 PM',b'CONST. OF PCC ROAD FROM KABIYA BHUIYA HOUSE TO NABA KAJORA MAIN ROAD (SANSAD X)/ 8/KAJORA GP/e-ten/(2020-21) / 2020_ZPHD_289757_4',b'West Bengal',b'2020_ZPHD_289757_4'
b'34120.',b'28-Dec-2020 12:00 AM',b'15-Jul-2020 05:00 PM',"b'Repairs and Maintenance of sewer line network by&amp;#x0d;\nmechanical means in various Sectors of Ulwe&amp;#x0d;\nNode, Navi Mumbai./ CANo03/CIDCO/EE(UlweI)/2020 / 2020_CIDCO_594447_1'",b'Maharashtra',b'2020_CIDCO_594447_1'
b'34101.',b'24-Sep-2020 12:00 AM',b'15-Jul-2020 05:00 PM',b'AR OF LR IN MOHINDERGARH CONSTITUENCY GROUP-IV IN DISTT MOHINDERGARH/ AR OF LR IN MOHINDERGARH CONSTITUENCY G-IV / 2020_HBC_135783_1',b'Haryana',b'2020_HBC_135783_1'
b'34102.',b'25-Sep-2020 12:00 AM',b'15-Jul-2020 05:00 PM',b'AR OF LR IN MOHINDERGARH CONSTITUENCY GROUP-VI IN DISTT MOHINDERGARH/ AR OF LR IN MOHINDERGARH CONSTITUENCY G-VI / 2020_HBC_135789_1',b'Haryana',b'2020_HBC_135789_1'
b'34103.',b'10-Nov-2020 12:00 AM',b'15-Jul-2020 05:00 PM',"b'Construction of pump house, providing and installation of pump sets, providing and laying of distribution pipe line, providing domestic connection etc/ 189/EE/DWS/DMN/2020-21 / 2020_CEDWS_11347_1'",b'Tripura',b'2020_CEDWS_11347_1'
b'34104.',b'04-Sep-2020 12:00 AM',b'15-Jul-2020 05:00 PM',b'Supply of Materials for Construction of Cement Concrete Road from Baro Pukur Parh to Prafulla Santra House at Manoharpur Utt in Manoharpur- II Gram&amp;#x0d;\nPanchayet under Chandrakona-I Panchayet Samiti (Under fund&amp;#x0d;\nMGNREGA)/ WBPASMID/MANII/PRA/NIT10/20-21 / 2020_ZPHD_289709_11',b'West Bengal',b'2020_ZPHD_289709_11'
b'34105.',b'30-Sep-2020 12:00 AM',b'15-Jul-2020 05:00 PM',"b'Renovation Work Forensic Science Laboratory (D.N.A. Lab) At RFSL, Rau Indore/ 04/2020-21/3 / 2020_MPPHC_98010_1'",b'Madhya Pradesh',b'2020_MPPHC_98010_1'
b'34106.',b'06-Aug-2020 12:00 AM',b'15-Jul-2020 05:00 PM',"b'Supply of Materials for Construction of Concrete Road form Bhunia Palli to Suman Bhunia House at Chandur, in Manoharpur-II Gram Panchayet under Chandrakona-I Panchayat Samiti&amp;#x0d;\n(Under Fund MGNREGA)/ WBPASMID/MANII/PRA/NIT10/20-21 / 2020_ZPHD_289709_2'",b'West Bengal',b'2020_ZPHD_289709_2'
b'34107.',b'06-Aug-2020 12:00 AM',b'15-Jul-2020 05:00 PM',"b'Supply of Materials for Construction of Concrete Road from Anirban Bhunia House to Pitch Road at Chandur, in Manoharpur-II Gram Panchayet under Chandrakona-I Panchayet Samiti (Under fund MGNREGA)/ WBPASMID/MANII/PRA/NIT10/20-21 / 2020_ZPHD_289709_6'",b'West Bengal',b'2020_ZPHD_289709_6'
b'34108.',b'27-Jul-2020 12:00 AM',b'15-Jul-2020 05:00 PM',b'Construction of Control Room building with toilet and other civil work at  New 33/11 KV S/S Chharch under O and M Circle Shivpuri/ DGM/C/GUNA/ET/2020-21/08/17 / 2020_MKVVC_98165_1',b'Madhya Pradesh',b'2020_MKVVC_98165_1'
b'34109.',b'28-Dec-2020 12:00 AM',b'15-Jul-2020 05:00 PM',b'RURAL PIPED WATER SUPPLY TO  CHATWA  GP.CHATWA   UNDER  NANDAPUR   BLOCK./ 03/EE/RWSS/KPT/20-21/03.07.20 / 2020_RWSS_61992_7',b'Odisha',b'2020_RWSS_61992_7'
b'34110.',b'06-Aug-2020 12:00 AM',b'15-Jul-2020 05:00 PM',"b'Supply of Materials for Construction of Concrete Road from Barun Mondal house to Durlav Dolai house at Sitarampur, in Manoharpur-II Gram Panchayet under Chandrakona-I Panchayet Samiti (Under fund&amp;#x0d;\nMGNREGA)/ WBPASMID/MANII/PRA/NIT10/20-21 / 2020_ZPHD_289709_7'",b'West Bengal',b'2020_ZPHD_289709_7'
b'34091.',b'25-Sep-2020 12:00 AM',b'15-Jul-2020 05:00 PM',b'AR OF LR IN MOHINDERGARH CONSTITUENCY GROUP-II IN DISTT MOHINDERGARH/ AR OF LR IN MOHINDERGARH CONSTITUENCY G-II / 2020_HBC_135772_1',b'Haryana',b'2020_HBC_135772_1'
b'34092.',b'25-Sep-2020 12:00 AM',b'15-Jul-2020 05:00 PM',b'AR OF LR IN MOHINDERGARH CONSTITUENCY GROUP-III IN DISTT MOHINDERGARH/ AR OF LR IN MOHINDERGARH CONSTITUENCY G-III / 2020_HBC_135777_1',b'Haryana',b'2020_HBC_135777_1'
b'34093.',b'03-Aug-2020 12:00 AM',b'15-Jul-2020 05:00 PM',b'Construction of Concrete Road from Ramesh Dangua house to Gura Dandapat house at Hanumanta Neguria/ 1/SFC(PBG)/e-NIT/(2020-21) / 2020_ZPHD_289663_1',b'West Bengal',b'2020_ZPHD_289663_1'
b'34094.',b'01-Dec-2020 12:00 AM',b'15-Jul-2020 05:00 PM',b'Extension of FHTC in existing new schemes within the jurisdiction of Dumburnagar RD Block under DWS Sub Division Gandacherra Gr_IV/ 47/EE/PWD(DWS)/AMB/2020-21 / 2020_CEDWS_11376_1',b'Tripura',b'2020_CEDWS_11376_1'
b'34095.',b'06-Aug-2020 12:00 AM',b'15-Jul-2020 05:00 PM',b'Supply of Materials for Construction of Concrete Road from Nitai Dolai house to Football ground via panchu Dolai in Manoharpur-II Gram Panchayet under Chandrakona-I Panchayet Samiti (Under fund&amp;#x0d;\nMGNREGA)/ WBPASMID/MANII/PRA/NIT10/20-21 / 2020_ZPHD_289709_12',b'West Bengal',b'2020_ZPHD_289709_12'
b'34096.',b'31-Aug-2020 12:00 AM',b'15-Jul-2020 05:00 PM',"b'Proposed Construction Of Barrack (Covid-19), D.R.P. Line, Indore/ 04/2020-21/1 / 2020_MPPHC_97998_1'",b'Madhya Pradesh',b'2020_MPPHC_97998_1'
