b'34523.',b'21-Dec-2020 12:00 AM',b'14-Jul-2020 03:40 PM',b'REPAIRS OF GRAMPANCHAYAT BUILDING PAKHORA TQ GANGAPUR DIST ABAD/ GP/PAKHORA/GPREPAIR/2020/VM / 2020_AURAN_594396_1',b'Maharashtra',b'2020_AURAN_594396_1'
b'34524.',b'28-Sep-2020 12:00 AM',b'14-Jul-2020 03:30 PM',b'clearing chocked up culvert and side drain/ PWD/2020-2021/14538/NDD / 2020_PWD_371689_1',b'Kerala',b'2020_PWD_371689_1'
b'34525.',b'28-Sep-2020 12:00 AM',b'14-Jul-2020 03:30 PM',b'works for avoiding water stagnation and small repairs of work/ PWD/2020-2021/14536/NDD / 2020_PWD_371700_1',b'Kerala',b'2020_PWD_371700_1'
b'34526.',b'31-Aug-2020 12:00 AM',b'14-Jul-2020 03:30 PM',b'Supply of Common Salt at Kapurthala Plant/ MARKFED/KPT/2020-21/01 / 2020_Coop_50575_2',b'Punjab',b'2020_Coop_50575_2'
b'34527.',b'31-Aug-2020 12:00 AM',b'14-Jul-2020 03:30 PM',b'Supply of Toxin Binder at Kapurthala Plant/ MARKFED/KPT/2020-21/01 / 2020_Coop_50575_3',b'Punjab',b'2020_Coop_50575_3'
b'34528.',b'31-Aug-2020 12:00 AM',b'14-Jul-2020 03:30 PM',b'Supply of Magnesium Oxide at Kapurthala Plant/ MARKFED/KPT/2020-21/01 / 2020_Coop_50575_4',b'Punjab',b'2020_Coop_50575_4'
b'34529.',b'11-Nov-2020 12:00 AM',b'14-Jul-2020 03:10 PM',b'Purchase of Kabaddi Mats/ 24/SEW/CE/2020-21 / 2020_DSYA_366649_2',b'Kerala',b'2020_DSYA_366649_2'
b'34530.',b'11-Dec-2020 12:00 AM',b'14-Jul-2020 03:00 PM',b'Shifting of Electric poles for Widening and strengthening of Belpahar town road from 0/00 Km to 6/100 Km connecting NH-49 Bypass at both end in Belpahar town in the District of Jharsuguda for the year 2018-19/ Bid Identification No-EE-RandB-JSG- 06 OF 2020-21 / 2020_EICCL_61976_8',b'Odisha',b'2020_EICCL_61976_8'
b'34501.',b'12-Aug-2020 12:00 AM',b'14-Jul-2020 04:00 PM',b'As per tender doument/ MCS/11/2019-20 / 2020_DMA_594325_15',b'Maharashtra',b'2020_DMA_594325_15'
b'34502.',b'19-Nov-2020 12:00 AM',b'14-Jul-2020 04:00 PM',b'Repairing and overhauling of the deep tube well pumps (22. 5 HP capacity) at BTPS Plant./ WBPDCL/BTPS/NIT/E1716/20-21 / 2020_WBPDC_289530_1',b'West Bengal',b'2020_WBPDC_289530_1'
b'34503.',b'09-Dec-2020 12:00 AM',b'14-Jul-2020 04:00 PM',"b'CONSTRUCTION OF SUB HEALTH CENTRE BUILDING AT VILLAGE SAMARBOH, MOYA, GWARIMAL, GUMTRA, PULPULDOH, SURREVANI, SONPUR AND SIREPANI (TOTAL 8 NOS.) BICHHUA BLOCK , DISTRICT CHHINDWARA (M.P.) (PACKAGE NO. 06 )/ 5/2019-20/dnchhindwara/dt 27.2.2020 / 2020_MPHID_97084_1'",b'Madhya Pradesh',b'2020_MPHID_97084_1'
b'34504.',b'08-Sep-2020 12:00 AM',b'14-Jul-2020 04:00 PM',b'Reinvited for Providing yard hydrant on the rear side of New OT cum ICU Complex in PGIMS Rohtak left out work of the fire fighting system by Ms HLL Ltd/ PWD/P4/454 / 2020_HRY_135643_1',b'Haryana',b'2020_HRY_135643_1'
b'34505.',b'11-Aug-2020 12:00 AM',b'14-Jul-2020 04:00 PM',b'As per tender document/ MCS/11/2019-20 / 2020_DMA_594325_8',b'Maharashtra',b'2020_DMA_594325_8'
b'34506.',b'16-Oct-2020 12:00 AM',b'14-Jul-2020 04:00 PM',b'Kulangara Thrikkai Nellithanam road in ward 8 of PAndanadu GP -Re tenderunder CMLRRP/ 1/AELSGD/PND/2020/21 / 2020_LSGD_367826_5',b'Kerala',b'2020_LSGD_367826_5'
b'34507.',b'12-Aug-2020 12:00 AM',b'14-Jul-2020 04:00 PM',b'As per tender documents/ MCS/11/2019-20 / 2020_DMA_594325_13',b'Maharashtra',b'2020_DMA_594325_13'
b'34508.',b'11-Aug-2020 12:00 AM',b'14-Jul-2020 04:00 PM',b'As per tender documents/ MCS/11/2019-20 / 2020_DMA_594325_11',b'Maharashtra',b'2020_DMA_594325_11'
b'34509.',b'12-Aug-2020 12:00 AM',b'14-Jul-2020 04:00 PM',b'As per tender doument/ MCS/11/2019-20 / 2020_DMA_594325_12',b'Maharashtra',b'2020_DMA_594325_12'
b'34510.',b'21-Jul-2020 12:00 AM',b'14-Jul-2020 04:00 PM',b'20/21 1Call Yearly Supply Of Construction Material At Gp Mahagaon Zillpi Ta Hingna Di Nagpur/ 20/21/GP/MOHAGAON ZILLPI/CONS/PS/HIN / 2020_NAGPU_594266_1',b'Maharashtra',b'2020_NAGPU_594266_1'
b'34481.',b'10-Dec-2020 12:00 AM',b'14-Jul-2020 05:00 PM',"b'CONSTRUCTION OF TOILET BLOCK AT EXISTING YOGBHAWAN, ADYADWALE LAYOUT, P. NO. 12, UNDER MCU, TAH. UMRED. DIST NAGPUR/ CIVIL/ 14072020 / 2020_DMA_594362_6'",b'Maharashtra',b'2020_DMA_594362_6'
b'34482.',b'01-Oct-2020 12:00 AM',b'14-Jul-2020 05:00 PM',b'supply for Misc. electrical items for tube wells and boosting station in ward no.03 and 4 MCG./ EE-WSS/MCG/2020/20678/2 / 2020_HRY_135676_1',b'Haryana',b'2020_HRY_135676_1'
b'34483.',b'10-Nov-2020 12:00 AM',b'14-Jul-2020 05:00 PM',"b'CONSTRUCTION OF PAY and USE TYPE PUBLIC TOILET BYPASS CHOWK, P. NO. 12, UNDER MCU, TAH. UMRED. DIST NAGPUR/ CIVIL/ 14072020 / 2020_DMA_594362_4'",b'Maharashtra',b'2020_DMA_594362_4'
b'34484.',b'07-Sep-2020 12:00 AM',b'14-Jul-2020 05:00 PM',b'Recall Dabri Providing Functional Household Tap Connection FHTC under Jal Jeevan Mission. Laying of D.I Pipe line in balance streets and providing Functional Household Tap Connection FHTC in village Dabri and all other works contingent thereto./ Laying of D.I Pipe line under JJM Dabri / 2020_HRY_134322_2',b'Haryana',b'2020_HRY_134322_2'
b'34485.',b'19-Sep-2020 12:00 AM',b'14-Jul-2020 05:00 PM',b'Infrastructure development of Dhekiakhowa  Namghar Jorhat/ SE(B)/JHT/C/S/S-14/1169 / 2020_PWBNH_18154_1',b'Assam',b'2020_PWBNH_18154_1'
b'34486.',b'25-Sep-2020 12:00 AM',b'14-Jul-2020 05:00 PM',b'33 KV Breakdown and its all related work/ 15/Const./2020-21 / 2020_KESCO_492864_1',b'Uttar Pradesh',b'2020_KESCO_492864_1'
b'34487.',b'30-Jul-2020 03:32 PM',b'14-Jul-2020 04:56 PM',"b'Replacement of 150mm dia SWG pipe line frequently chowkages with 250mm dia SWG sewerage pipe line from H.No.4-9-459/3 to 4-9-463 at Vinayaka nagar colony, Hayath nagar under Auto nagar section, SD-II of OM Div.X/ 25/CGM(E)/OM C.I/DB-Genl/2020-21 date.14.07.2020 / 185181'",b'Telegana',b'185181'
b'34488.',b'23-Nov-2020 12:00 AM',b'14-Jul-2020 04:45 PM',b'Improvements to the Sub Health Centre at  Kottucherrymedu Karaikal./ 08-03/PW/BRK/KKL/2020-21 / 2020_PWDC3_6381_1',b'Puducherry UT',b'2020_PWDC3_6381_1'
b'34489.',b'21-Dec-2020 12:00 AM',b'14-Jul-2020 04:45 PM',b'Improvements to the Primary Health Centre at Vizhidiyur in Karaikal./ 08-02/PW/BRK/KKL/2020-21 / 2020_PWDC3_6380_1',b'Puducherry UT',b'2020_PWDC3_6380_1'
b'34490.',b'27-Jul-2020 12:00 AM',b'14-Jul-2020 04:35 PM',b'Supply of Material for GP AADASA Year 2020-2021/ PSMOUDA/ADASA/2020/21/120 / 2020_NAGPU_594444_1',b'Maharashtra',b'2020_NAGPU_594444_1'
b'34471.',b'11-Nov-2020 12:00 AM',b'14-Jul-2020 05:00 PM',b'Supply of S.S. Electrodes in Irrigation department/ TE-924/2020-21 / 2020_UPIDM_492859_1',b'Uttar Pradesh',b'2020_UPIDM_492859_1'
b'34472.',b'21-Oct-2020 12:00 AM',b'14-Jul-2020 05:00 PM',b'Construction of drain from Sepient School to East side drain ward no.42/ 1799/SMC/2020 / 2020_UAD_97916_1',b'Madhya Pradesh',b'2020_UAD_97916_1'
b'34473.',b'24-Nov-2020 12:00 AM',b'14-Jul-2020 05:00 PM',b'Provide And Manage the Four Wheeler A.C. Vehicle  along with Driver  on Rental basis in Division No.06 Bhopal/ 01/2020-21 Ist Call / 2020_MPHID_96266_1',b'Madhya Pradesh',b'2020_MPHID_96266_1'
b'34474.',b'16-Dec-2020 12:00 AM',b'14-Jul-2020 05:00 PM',b'Procurement of Spares for A.C Compressors Model JS64F Q50B total quantity(As per NIT)/ 1243/OandM/PC-2130 dated 14-07-2020 / 2020_POWER_50543_1',b'Punjab',b'2020_POWER_50543_1'
b'34475.',b'25-Sep-2020 12:00 AM',b'14-Jul-2020 05:00 PM',b'33 KV Breakdown and its all related work/ 15/Const./2020-21 / 2020_KESCO_492864_1',b'Uttar Pradesh',b'2020_KESCO_492864_1'
b'34476.',b'10-Nov-2020 12:00 AM',b'14-Jul-2020 05:00 PM',"b'CONSTRUCTION OF PAY and  USE TYPE PUBLIC TOILET IN FRONT OF PWD REST HOUSE, P. NO. 9, UNDER MCU, TAH. UMRED. DIST NAGPUR/ CIVIL/ 14072020 / 2020_DMA_594362_3'",b'Maharashtra',b'2020_DMA_594362_3'
b'34477.',b'10-Nov-2020 12:00 AM',b'14-Jul-2020 05:00 PM',"b'CONSTRUCTION OF PAY and USE TYPE PUBLIC TOILET BYPASS CHOWK, P. NO. 12, UNDER MCU, TAH. UMRED. DIST NAGPUR/ CIVIL/ 14072020 / 2020_DMA_594362_4'",b'Maharashtra',b'2020_DMA_594362_4'
b'34478.',b'04-Dec-2020 12:00 AM',b'14-Jul-2020 05:00 PM',b'Widening of Hoshiarpur Una Road to Bullanwari Bajwara Road/ 5.2 / 2020_CEPW_50538_1',b'Punjab',b'2020_CEPW_50538_1'
b'34479.',b'31-Aug-2020 12:00 AM',b'14-Jul-2020 05:00 PM',b'LAYING OF DI PIPELINE IN BALANCE STREETS AND PROVIDING FUNCTIONAL HOUSEHOLD TAP CONNECTION FHTC IN VILLAGE UNTLA AND ALL OTHER WORKS CONTINGENT THERETO/ SE PHEC KNL NO.9287 DATED 10.07.2020 / 2020_HRY_135574_1',b'Haryana',b'2020_HRY_135574_1'
b'34480.',b'18-Oct-2020 12:00 AM',b'14-Jul-2020 05:00 PM',b'CMLRRP  2020 21  Kannur District  Udayapuram Kovvapuram Railway Gate Road Drainage Construction and Road Maintenance Work in Kunhimangalam GP/ AE/LSGD/ ETENDER/KGP/03/2020-21 / 2020_LSGD_371586_1',b'Kerala',b'2020_LSGD_371586_1'
b'34461.',b'10-Nov-2020 12:00 AM',b'14-Jul-2020 05:00 PM',"b'CONSTRUCTION OF PAY and USE TYPE PUBLIC TOILET NEAR GOVT. GRAIN GODOWN AT UMRED GIRAD ROAD, P. NO. 11, UNDER MCU, TAH. UMRED. DIST NAGPUR/ CIVIL/ 14072020 / 2020_DMA_594362_1'",b'Maharashtra',b'2020_DMA_594362_1'
b'34462.',b'01-Oct-2020 12:00 AM',b'14-Jul-2020 05:00 PM',b'supply for Misc. electrical items for tube wells and boosting station in ward no.03 and 4 MCG./ EE-WSS/MCG/2020/20678/2 / 2020_HRY_135676_1',b'Haryana',b'2020_HRY_135676_1'
b'34463.',b'24-Jul-2020 12:00 AM',b'14-Jul-2020 05:00 PM',"b'Constructing Chain Link Fencing Compound to Anganwadi Building at Satare Taluka Yeola, Dist. Nashik/ E-TENDERNOTICENO-1-WN-1 / 2020_NASHI_594388_1'",b'Maharashtra',b'2020_NASHI_594388_1'
b'34464.',b'12-Oct-2020 12:00 AM',b'14-Jul-2020 05:00 PM',b'E-Tender is inviting from Local Printing Firms for printing and supply of IEC/BCC materials/advertisement on COVID-19/ F.N.1-83/SHEB/DHS/IEC /COVID-19/ 2020/45 / 2020_DHS_499_1',b'Andaman and Nicobar Island',b'2020_DHS_499_1'
b'34465.',b'19-Sep-2020 12:00 AM',b'14-Jul-2020 05:00 PM',b'Infrastructure development of Dhekiakhowa  Namghar Jorhat/ SE(B)/JHT/C/S/S-14/1169 / 2020_PWBNH_18154_1',b'Assam',b'2020_PWBNH_18154_1'
b'34466.',b'04-Dec-2020 12:00 AM',b'14-Jul-2020 05:00 PM',b'Widening of Hoshiarpur Una Road to Bullanwari Bajwara Road/ 5.2 / 2020_CEPW_50538_1',b'Punjab',b'2020_CEPW_50538_1'
b'34467.',b'18-Oct-2020 12:00 AM',b'14-Jul-2020 05:00 PM',b'CMLRRP  2020 21  Kannur District  Udayapuram Kovvapuram Railway Gate Road Drainage Construction and Road Maintenance Work in Kunhimangalam GP/ AE/LSGD/ ETENDER/KGP/03/2020-21 / 2020_LSGD_371586_1',b'Kerala',b'2020_LSGD_371586_1'
b'34468.',b'10-Nov-2020 12:00 AM',b'14-Jul-2020 05:00 PM',"b'CONSTRUCTION OF PAY and  USE TYPE PUBLIC TOILET IN FRONT OF PWD REST HOUSE, P. NO. 9, UNDER MCU, TAH. UMRED. DIST NAGPUR/ CIVIL/ 14072020 / 2020_DMA_594362_3'",b'Maharashtra',b'2020_DMA_594362_3'
b'34469.',b'09-Sep-2020 12:00 AM',b'14-Jul-2020 05:00 PM',b'Recall Dabrthala Providing Functional Household Tap Connection FHTC under Jal Jeevan Mission. Laying of D.I Pipe line in balance streets and providing Functional Household Tap Connection FHTC in village Dabrthala and all other works contingent theret/ Laying of D.I Pipe line under JJM Dabarthala / 2020_HRY_134327_2',b'Haryana',b'2020_HRY_134327_2'
b'34470.',b'10-Nov-2020 12:00 AM',b'14-Jul-2020 05:00 PM',"b'CONSTRUCTION OF PAY and USE TYPE PUBLIC TOILET BYPASS CHOWK, P. NO. 12, UNDER MCU, TAH. UMRED. DIST NAGPUR/ CIVIL/ 14072020 / 2020_DMA_594362_4'",b'Maharashtra',b'2020_DMA_594362_4'
b'34451.',b'26-Nov-2020 12:00 AM',b'14-Jul-2020 05:15 PM',"b'Construction of HL Bridge 2 Span 9 M (S) 9.93 (S) eff. over Lehragaga Main drain x_ing link road on Sangrur_Patran to Ladbanjara to Ubhe at RD 4500 in Distt. Sangrur including approaches, diversion, dismantling of old damaged bridge/ Bid No 15 Dt. 15.06.2020 / 2020_CEPW_50565_1'",b'Punjab',b'2020_CEPW_50565_1'
b'34452.',b'28-Dec-2020 12:00 AM',b'14-Jul-2020 05:15 PM',"b'Improvements to the Sub Health Centre  at Melaoduthurai, Karaikal./ 08-05/PW/BRK/KKL/2020-21 / 2020_PWDC3_6384_1'",b'Puducherry UT',b'2020_PWDC3_6384_1'
b'34453.',b'24-Sep-2020 12:00 AM',b'14-Jul-2020 05:10 PM',"b'PROVIDING S.T. AND B.T.  TO HONABLE  HIGH COURT JUSTICE BUNGLOW VIZ.DAYA, KSHAMA,SHANTI, CHITRA,VIDHI,UTTARA, ANURADHA,VISHAKHA, NAMARATA,SUNIT, SATYASHIL,SOUMITRA, MANAS,MATOSHRI, SEWA,SAMATA,SNEHA, VIVEK,HIRANYAGARBH, SOUDAMINI,AT CIVILLINES,NAGPUR/ pwc/ngp/div1/07-02/2020-21 / 2020_PWR_594514_1'",b'Maharashtra',b'2020_PWR_594514_1'
b'34454.',b'31-Aug-2020 12:00 AM',b'14-Jul-2020 05:00 PM',b'LAYING OF DI PIPELINE IN BALANCE STREETS AND PROVIDING FUNCTIONAL HOUSEHOLD TAP CONNECTION FHTC IN VILLAGE UNTLA AND ALL OTHER WORKS CONTINGENT THERETO/ SE PHEC KNL NO.9287 DATED 10.07.2020 / 2020_HRY_135574_1',b'Haryana',b'2020_HRY_135574_1'
b'34455.',b'09-Sep-2020 12:00 AM',b'14-Jul-2020 05:00 PM',b'Recall Dabrthala Providing Functional Household Tap Connection FHTC under Jal Jeevan Mission. Laying of D.I Pipe line in balance streets and providing Functional Household Tap Connection FHTC in village Dabrthala and all other works contingent theret/ Laying of D.I Pipe line under JJM Dabarthala / 2020_HRY_134327_2',b'Haryana',b'2020_HRY_134327_2'
b'34456.',b'31-Dec-2020 12:00 AM',b'14-Jul-2020 05:00 PM',b'Door to door collection of solid waste in Block A and Food Park at IE Rai/ HSIIDC/RAI/52 / 2020_HBC_135546_1',b'Haryana',b'2020_HBC_135546_1'
b'34457.',b'16-Dec-2020 12:00 AM',b'14-Jul-2020 05:00 PM',b'Procurement of Spares for A.C Compressors Model JS64F Q50B total quantity(As per NIT)/ 1243/OandM/PC-2130 dated 14-07-2020 / 2020_POWER_50543_1',b'Punjab',b'2020_POWER_50543_1'
b'34458.',b'24-Jul-2020 12:00 AM',b'14-Jul-2020 05:00 PM',"b'Constructing Chain Link Fencing Compound to Anganwadi Building at Satare Taluka Yeola, Dist. Nashik/ E-TENDERNOTICENO-1-WN-1 / 2020_NASHI_594388_1'",b'Maharashtra',b'2020_NASHI_594388_1'
b'34459.',b'24-Nov-2020 12:00 AM',b'14-Jul-2020 05:00 PM',b'Provide And Manage the Four Wheeler A.C. Vehicle  along with Driver  on Rental basis in Division No.06 Bhopal/ 01/2020-21 Ist Call / 2020_MPHID_96266_1',b'Madhya Pradesh',b'2020_MPHID_96266_1'
b'34460.',b'14-Aug-2020 12:00 AM',b'14-Jul-2020 05:00 PM',"b'Fixing paving block in Common Public Place (Smashanbhumi) at Vadzire, Tal- Parner, Dist- Ahmednagar/ GP/E-TENDER/2019-20/2ca / 2020_AHMED_594238_1'",b'Maharashtra',b'2020_AHMED_594238_1'
b'34431.',b'30-Oct-2020 12:00 AM',b'14-Jul-2020 06:00 PM',b'DP Works 2020-21- Kokkayar GP - Enthayaar Puthiyathu kana Road (80/21) tender/ 03/EE/LSGD/IDK/TENDERS/20-21 / 2020_LSGD_369535_10',b'Kerala',b'2020_LSGD_369535_10'
b'34432.',b'08-Sep-2020 12:00 AM',b'14-Jul-2020 05:55 PM',b'Inst of 1 HP Submersible with tank near Kanpur Kali Mandir at Kanpur/ JGM/GOPI-II/TAPSIA/166 / 2020_ZPHD_289614_1',b'West Bengal',b'2020_ZPHD_289614_1'
b'34433.',b'25-Nov-2020 12:00 AM',b'14-Jul-2020 05:55 PM',b'Construction of Wall to Retain Flood Water on Terna River Bank At Ter Tq Dist Osmanabad Scheme 14th FC for year 2017_18/ E TENDER NO 1/2020-21 / 2020_OSMAN_594450_1',b'Maharashtra',b'2020_OSMAN_594450_1'
b'34434.',b'31-Jul-2020 12:00 AM',b'14-Jul-2020 05:55 PM',b'SUPPLY VARIOUS TYPE OF CONSTRUCTION MATERIAL GP BOLDE/ ZP BHANDARA/PS SAKOLI/GP BOLADE-SALAE/E-T1/2020-21 / 2020_BHAND_594506_1',b'Maharashtra',b'2020_BHAND_594506_1'
b'34435.',b'18-Nov-2020 12:00 AM',b'14-Jul-2020 05:55 PM',"b'Painting and repairing of road kerb for Central Median and Road Flank both side  at Street no  676 from MAR to Rajarhat Road, Action Area IID  New town Kolkata/ 2845  /EE-III(EE-I)/ 10 /NKDA/20 / 2020_NKDA_289557_1'",b'West Bengal',b'2020_NKDA_289557_1'
b'34436.',b'08-Sep-2020 12:00 AM',b'14-Jul-2020 05:55 PM',b'Inst of 3 HP Submersible near Gakul Shaw land at Kenduana/ JGM/GOPI-II/TAPSIA/165 / 2020_ZPHD_289603_1',b'West Bengal',b'2020_ZPHD_289603_1'
b'34437.',b'08-Sep-2020 12:00 AM',b'14-Jul-2020 05:55 PM',b'Inst of 3 HP Submersible near Ashis Karan land at Kenduana/ JGM/GOPI-II/TAPSIA/165 / 2020_ZPHD_289603_2',b'West Bengal',b'2020_ZPHD_289603_2'
b'34438.',b'28-Dec-2020 12:00 AM',b'14-Jul-2020 05:50 PM',"b'CONSTRUCTION OF BRIDGE, WIDENING OF ROAD and  ROAD and RCC NALA AT KAWARAPET, P. NO. 5, UNDER MCU, TAH. UMRED. DIST NAGPUR/ CIVIL/ 14072020 / 2020_DMA_594362_8'",b'Maharashtra',b'2020_DMA_594362_8'
b'34439.',b'31-Aug-2020 12:00 AM',b'14-Jul-2020 05:50 PM',"b'Kundrawali Estimate for providing functional household tap connection and laying of pipeline under Jal Jeevan Mission, Tehsil and Distt. Jhajjar/ SE JJR No. 7826 dated 14.07.2020 FHTC Kundrawali / 2020_HRY_135688_1'",b'Haryana',b'2020_HRY_135688_1'
b'34440.',b'17-Aug-2020 12:00 AM',b'14-Jul-2020 05:40 PM',b'ANNUAL MAINTENANCE OF 2 NOS. ELEVATORS THYSSENKRUPP MAKE INSTALLED IN LINK PASS IN NEW DISTRICT COURT COMPLEX SEC 43 CHANDIGARH./ E-3/3672-79 / 2019_CHD_51541_7',b'Chandigarh UT',b'2019_CHD_51541_7'
b'34411.',b'24-Jul-2020 12:00 AM',b'14-Jul-2020 06:00 PM',b'Constraction of cement concreate road from Suratganj Pitch road to Das para/ 08/SIRSHAGP/CFCG/2020-2021 / 2020_ZPHD_289619_1',b'West Bengal',b'2020_ZPHD_289619_1'
b'34412.',b'02-Nov-2020 12:00 AM',b'14-Jul-2020 06:00 PM',b'Construction/ 47/EEBK/2020-2021 / 2020_PWD_371793_1',b'Kerala',b'2020_PWD_371793_1'
b'34413.',b'01-Oct-2020 12:00 AM',b'14-Jul-2020 06:00 PM',b'rectification of VCB/ AEE/MISDN/ALY/34/ET/2020-21/S / 2020_Irrig_371745_1',b'Kerala',b'2020_Irrig_371745_1'
b'34414.',b'21-Aug-2020 12:00 AM',b'14-Jul-2020 06:00 PM',"b'Annual / ordinary repair of various link roads (Group No.2) In Palwal Constituency (Road ID H-805, 706, 780, 759, 809/ HSAMB FARIDABAD 2020 / 2020_HBC_135693_1'",b'Haryana',b'2020_HBC_135693_1'
b'34415.',b'07-Dec-2020 12:00 AM',b'14-Jul-2020 06:00 PM',"b'Work contract for complete overhauling servicing with        successful trial of tandem operation of 02  nos. 175/30 T EOT cranes including supply of spares and             consumables installed at 3x105 MW, THPS-I, Sirmour./ 91-84/GS/ Works /827 / 2020_MPPGC_96689_1'",b'Madhya Pradesh',b'2020_MPPGC_96689_1'
b'34416.',b'07-Aug-2020 12:00 AM',b'14-Jul-2020 06:00 PM',b'Construction of concrete road from the house of Areshtulla towards Idgha Maidan at Vikanpur/ 08/R-I / Lochanpur/14th FC/2020-21(2nd Call) / 2020_ZPHD_289610_1',b'West Bengal',b'2020_ZPHD_289610_1'
b'34417.',b'01-Oct-2020 12:00 AM',b'14-Jul-2020 06:00 PM',b'Provisions included in this estimateare&amp;#x0d;\nproviding patch plastering with polymers providing and fixing precoated&amp;#x0d;\ngalvanised iron profile sheets etc&amp;#x0d;/ PWD/2020-2021/9011/ / 2020_PWD_371791_1',b'Kerala',b'2020_PWD_371791_1'
b'34418.',b'09-Nov-2020 12:00 AM',b'14-Jul-2020 06:00 PM',b'Repairing Work of India Mark II Hand pump for block  Maihar Inclusive of Free Service of Departmental Tecnician Under District Satna (M.P.)/ 8 / 2020_PHED_97867_1',b'Madhya Pradesh',b'2020_PHED_97867_1'
b'34419.',b'27-Aug-2020 12:00 AM',b'14-Jul-2020 06:00 PM',b'Ward 6 - Shaji Pan Shop - Railway Line road sub road Maintenance/ 19/06/2020 / 2020_LSGD_367093_2',b'Kerala',b'2020_LSGD_367093_2'
b'34420.',b'11-Nov-2020 12:00 AM',b'14-Jul-2020 06:00 PM',"b'Renovation of Causality at Govt. Medical College ,Kozhikode-Electrification/ ELSD/TN/03/2020-21 / 2020_PWD_367560_2'",b'Kerala',b'2020_PWD_367560_2'
b'34401.',b'22-Sep-2020 12:00 AM',b'14-Jul-2020 06:00 PM',b'Repairing Work of India Mark II Hand pump for block  Ramnagar Inclusive of Free Service of Departmental Tecnician Under District Satna (M.P.)/ 8 / 2020_PHED_97867_2',b'Madhya Pradesh',b'2020_PHED_97867_2'
b'34402.',b'07-Aug-2020 12:00 AM',b'14-Jul-2020 06:00 PM',b'Construction of concrete road from the house of Mostakin Sks towards Mosjid atLochanpur Sekhpara/ 07/R-I /Lochanpur/14th FC/2020-21 (2nd Call) / 2020_ZPHD_289595_1',b'West Bengal',b'2020_ZPHD_289595_1'
b'34403.',b'02-Dec-2020 12:00 AM',b'14-Jul-2020 06:00 PM',b'LSGD CMLRRP 2019/20 First Phase Kasaragod District Udma LAC Kanhangad blockPallikara GP Pakkam Kanathumkai Thachangad road re tarring/ 01/2020/AE/LSGD/PK / 2020_LSGD_371688_1',b'Kerala',b'2020_LSGD_371688_1'
b'34404.',b'30-Oct-2020 12:00 AM',b'14-Jul-2020 06:00 PM',b'DP Works 2020-21- Kokkayar GP - Enthayaar Puthiyathu kana Road (80/21) tender/ 03/EE/LSGD/IDK/TENDERS/20-21 / 2020_LSGD_369535_10',b'Kerala',b'2020_LSGD_369535_10'
b'34405.',b'22-Oct-2020 12:00 AM',b'14-Jul-2020 06:00 PM',b'Refer Tender Document/ RKI-6/EE/LSGD/2020-21 / 2020_LSGD_355788_4',b'Kerala',b'2020_LSGD_355788_4'
b'34406.',b'07-Aug-2020 12:00 AM',b'14-Jul-2020 06:00 PM',b'Construction of concrete road from the house of Areshtulla towards Idgha Maidan at Vikanpur/ 08/R-I / Lochanpur/14th FC/2020-21(2nd Call) / 2020_ZPHD_289610_1',b'West Bengal',b'2020_ZPHD_289610_1'
b'34407.',b'29-Sep-2020 12:00 AM',b'14-Jul-2020 06:00 PM',b'Sl. No. 01..Internal pipe connection with CIDF and CI.DI pipe and delivery pipe connection with HDPE pipe along with construction of Boundary wall  with drain i.c.w. Reservoir at Head works site  for  PASCHIM SALBARI (ZONE-I)  WATER  SUPPLY  SCHEME/ NIT No. WBPHED/EE/JD/eNIT- 06/2020-21 / 2020_PHED_289606_1',b'West Bengal',b'2020_PHED_289606_1'
b'34408.',b'19-Aug-2020 12:00 AM',b'14-Jul-2020 06:00 PM',b'Construction of concrete road from the house of Abdur Rajjak towards Siddiks house at Nawdapara/ 10/R-I / Lochanpur/14th FC/2020-21(2nd Call) / 2020_ZPHD_289665_1',b'West Bengal',b'2020_ZPHD_289665_1'
b'34409.',b'21-Aug-2020 12:00 AM',b'14-Jul-2020 06:00 PM',"b'Annual / ordinary repair of various link roads (group no.1) in Prithla constituency (road ID H-660, 666, 698, 682, 4600)./ HSAMB FARIDABAD 2020 / 2020_HBC_135651_1'",b'Haryana',b'2020_HBC_135651_1'
b'34410.',b'02-Nov-2020 12:00 AM',b'14-Jul-2020 06:00 PM',b'Construction/ 47/EEBK/2020-2021 / 2020_PWD_371793_1',b'Kerala',b'2020_PWD_371793_1'
b'34381.',b'19-Dec-2020 12:00 AM',b'15-Jul-2020 09:00 AM',"b'P/L interlocking tile, DB paving pach work and other work in difference area in Muktsar city./ LG/MC/Sri Muktsar Sahib/2020/06 / 2020_DLG_50541_1'",b'Punjab',b'2020_DLG_50541_1'
b'34382.',b'04-Aug-2020 12:00 AM',b'15-Jul-2020 09:00 AM',b'P/F Physical and Children games at K.P.Park/ MCJ/(B and R) 2020-21/10 / 2020_DLG_50524_14',b'Punjab',b'2020_DLG_50524_14'
b'34383.',b'27-Aug-2020 12:00 AM',b'15-Jul-2020 09:00 AM',b'Alamkode Grama PAnchayath 2020 21 Mankulam High School road re taring re e tender/ T3/AE/LSGD/ALKD/2020 dt. 14-7-2020 / 2020_LSGD_371819_2',b'Kerala',b'2020_LSGD_371819_2'
b'34384.',b'19-Dec-2020 12:00 AM',b'15-Jul-2020 09:00 AM',b'Const. of drain type 1 and drain type 2 in chakbir Sarkar road./ LG/MC/Sri Muktsar Sahib/2020/06 / 2020_DLG_50541_4',b'Punjab',b'2020_DLG_50541_4'
b'34385.',b'05-Oct-2020 12:00 AM',b'15-Jul-2020 09:00 AM',b'CMLRRP KBD 2020 Renovation work of Kandathilpady Mannumpurathupady Road in ward 1 ofKadampanadu GP/ 2/AE/LSGD/KBD/2020-21 / 2020_LSGD_371638_1',b'Kerala',b'2020_LSGD_371638_1'
b'34386.',b'24-Aug-2020 12:00 AM',b'15-Jul-2020 09:00 AM',b'CMLRRP 2020-21 Sl No-1363 KANJIRATHARA NAMBIKULATHU KAVU MANGALASERRY ROAD IN PATTUVAM GP/ AE/PTVM/ETEN2/20-21 / 2020_LSGD_371820_2',b'Kerala',b'2020_LSGD_371820_2'
b'34387.',b'12-Nov-2020 12:00 AM',b'15-Jul-2020 09:00 AM',b'S0079.21.AMBALATHARA ROAD CONCRETING IN WARD NO.01OF MATTATHUR GP/ e.Tender1.79.21 / 2020_LSGD_371812_1',b'Kerala',b'2020_LSGD_371812_1'
b'34388.',b'19-Aug-2020 12:00 AM',b'15-Jul-2020 09:00 AM',"b'Balance Electrical Work of  6 Nos Type-II Residences and 12 Nos Type-III Residences at RIRD, Dasna, Ghaziabad/ 001/EEE/GZB/E-TENDER/2020-2021 / 2020_SCIDC_493026_1'",b'Uttar Pradesh',b'2020_SCIDC_493026_1'
b'34389.',b'23-Oct-2020 12:00 AM',b'15-Jul-2020 09:00 AM',"b'Supplying, installation, testing and commissioning of 04 Nos. 52 HP 4R 1040 diesel engine coupled with DSM 80/36 pumps 03 Nos. for Swadeshnagar Section and 01 No. for Mayabunder Section under Sub - Division No.IV EM, NACD, APWD, Mayabunder./ NIT NO.10/EE/NACD/2020-21 / 2020_APWD_488_1'",b'Andaman and Nicobar Island',b'2020_APWD_488_1'
b'34390.',b'19-Nov-2020 12:00 AM',b'14-Jul-2020 06:55 PM',b'R/P 2019-20 Improvements to Panmana Asramam- Panayannarkavu Road ch 0/000 to 2/500/ PWD/2019-2020/10749/SOUTHCIR / 2020_PWD_345338_4',b'Kerala',b'2020_PWD_345338_4'
b'34361.',b'08-Oct-2020 12:00 AM',b'15-Jul-2020 09:00 AM',b'S0176.21.RENOVATION WORKS TO CHOKKANA CANTEEN ROAD WARD 9 OF MATTATHUR GP/ e.Tender6.176.21 / 2020_LSGD_371625_1',b'Kerala',b'2020_LSGD_371625_1'
b'34362.',b'04-Aug-2020 12:00 AM',b'15-Jul-2020 09:00 AM',b'Const. of 60mm thick interlocking tiles streets opposite tools industry./ MCJ/(B and R) 2020-21/10 / 2020_DLG_50524_44',b'Punjab',b'2020_DLG_50524_44'
b'34363.',b'24-Aug-2020 12:00 AM',b'15-Jul-2020 09:00 AM',b'CMLRRP 2020-21 Sl No-1363 KANJIRATHARA NAMBIKULATHU KAVU MANGALASERRY ROAD IN PATTUVAM GP/ AE/PTVM/ETEN2/20-21 / 2020_LSGD_371820_2',b'Kerala',b'2020_LSGD_371820_2'
b'34364.',b'04-Aug-2020 12:00 AM',b'15-Jul-2020 09:00 AM',b'Const. of streets of Deep nagar in interlocking tiles./ MCJ/(B and R) 2020-21/10 / 2020_DLG_50524_37',b'Punjab',b'2020_DLG_50524_37'
b'34365.',b'30-Jul-2020 12:00 AM',b'15-Jul-2020 09:00 AM',b'Vikash khand Airaya ke gram dayalpur me panchayat ghar se Akhilesh ke ghar hokar uday yadav ke ghar tak Interlocking./ 16-343/RED/E-Tender/2020-21 Dated 07.07.2020 / 2020_REDUP_492547_1',b'Uttar Pradesh',b'2020_REDUP_492547_1'
b'34366.',b'19-Aug-2020 12:00 AM',b'15-Jul-2020 09:00 AM',"b'Balance Electrical Work of  6 Nos Type-II Residences and 12 Nos Type-III Residences at RIRD, Dasna, Ghaziabad/ 001/EEE/GZB/E-TENDER/2020-2021 / 2020_SCIDC_493026_1'",b'Uttar Pradesh',b'2020_SCIDC_493026_1'
b'34367.',b'04-Aug-2020 12:00 AM',b'15-Jul-2020 09:00 AM',"b'Const. of lanes in interlocking tiles in New Green Model Town, Shiv Vihar./ MCJ/(B and R) 2020-21/10 / 2020_DLG_50524_32'",b'Punjab',b'2020_DLG_50524_32'
b'34368.',b'04-Aug-2020 12:00 AM',b'15-Jul-2020 09:00 AM',"b'Const. of streets with interlocking tiles in Garden Colony, W.No.31/ MCJ/(B and R) 2020-21/10 / 2020_DLG_50524_31'",b'Punjab',b'2020_DLG_50524_31'
