S.No.,AOC Date,e-Published Date,Title and Ref.No./Tender Id,State Name
b'34991.',b'11-Aug-2020 12:00 AM',b'13-Jul-2020 01:00 PM',b'Construction of Kitchen and Dining of Premetric Girls I Hostel Agali  Palakkad/ KSNK/TECH/PLKD/AGKD-92(R)/2020 / 2020_KSNK_371492_1',b'Kerala',b'2020_KSNK_371492_1'
b'34992.',b'27-Jul-2020 12:00 AM',b'13-Jul-2020 01:00 PM',b'SALE OF SUGAR/ 2020/07/10/NSRSUGAR/06 / 2020_Coop_50497_1',b'Punjab',b'2020_Coop_50497_1'
b'34993.',b'01-Sep-2020 12:00 AM',b'13-Jul-2020 12:30 PM',"b'Supply Installation and Commissioning of Software Defined Wide Area Network( SDWAN) Solutions in Kerala Police Including State Data Centre, Police Higher Offices and Police Stations/ KPET/02/2020/APB / 2020_KP_371470_2'",b'Kerala',b'2020_KP_371470_2'
b'34994.',b'22-Jul-2020 12:00 AM',b'13-Jul-2020 12:10 PM',b'SUGAR SALE 1000 QTL/ BUDHEWAL13072020 / 2020_Coop_50486_1',b'Punjab',b'2020_Coop_50486_1'
b'34995.',b'02-Sep-2020 12:00 AM',b'13-Jul-2020 12:00 PM',b'Construction of ESR for Prabhag No.15 Under Nagari Dalit Wasti Sudhar Yojana N.P.Lakhandur/ WaterTank_2020 / 2020_DMA_593494_1',b'Maharashtra',b'2020_DMA_593494_1'
b'34996.',b'29-Aug-2020 12:00 AM',b'13-Jul-2020 12:00 PM',b'P/L Interlocking Tiles 60mm thicks and Drinas Near S.Soldier School to BLO H/O Lakhbir Singh in  ward No.5/ E-tender/2020-21/01 / 2020_DLG_50475_28',b'Punjab',b'2020_DLG_50475_28'
b'34997.',b'29-Aug-2020 12:00 AM',b'13-Jul-2020 12:00 PM',b'P/L Interlocking Tiles 60mm thicks and Drinas Babla Photographer to H/O Harbans Lal Bhatti in ward No.5/ E-tender/2020-21/01 / 2020_DLG_50475_27',b'Punjab',b'2020_DLG_50475_27'
b'34998.',b'10-Aug-2020 12:00 AM',b'13-Jul-2020 12:00 PM',"b'Providing Temp Illumination for Independence Day on 15 th August 2020 on Dome and Tower Building at Navin Vidhan Bhavan,Mumbai/ Est No 9003 Temp Illumination at New Vidhan Bhavan / 2020_PWDM_593759_1'",b'Maharashtra',b'2020_PWDM_593759_1'
b'34999.',b'29-Sep-2020 12:00 AM',b'13-Jul-2020 12:00 PM',b'New LED Street Light Point Compleet Set in SDM Office Hoshiarpur road to Oasis Hotal Garhshankar/ E-tender/2020-21/01 / 2020_DLG_50475_33',b'Punjab',b'2020_DLG_50475_33'
b'35000.',b'10-Aug-2020 12:00 AM',b'13-Jul-2020 12:00 PM',"b'CONSTRUCTION OF SCIENCE LAB, LIBRARY ROOM, ART AND CRAFT ROOM AT BLOCK DHARI NAINITAL/ 364 dated 10-07-2020 / 2020_RES_24921_1'",b'Uttarakhand',b'2020_RES_24921_1'
b'34981.',b'30-Jul-2020 05:01 PM',b'13-Jul-2020 01:14 PM',"b'Supply Delivery and installation  of  (16) nos Pre-fabricated Modular Male and Female Toilets at ward 105 Gachibowli in Serilingampally  DIV20 in SLP Zone, GHMC(Item 2)/ 16/EE/CIR-20/SLPZ/GHMC/1-3/2020-21 Dt:10.07.2020 / 184936'",b'Telegana',b'184936'
b'34982.',b'30-Jul-2020 05:03 PM',b'13-Jul-2020 01:10 PM',"b'Supply Delivery and installation  of  (16) nos Pre-fabricated Modular Male and Female Toilets at ward 104 Kondapur in Serilingampally  DIV20 in SLP Zone, GHMC(Item 1)/ 16/EE/CIR-20/SLPZ/GHMC/1-3/2020-21 Dt:10.07.2020 / 184933'",b'Telegana',b'184933'
b'34983.',b'28-Jul-2020 02:13 PM',b'13-Jul-2020 01:07 PM',b'Laying of CC patch works in Pranav Valley of Bachupally in Nizampet Municipal Corporation under Municipal General Funds for the year 2019-20./ E1/1920/2019-20 / 184930',b'Telegana',b'184930'
b'34984.',b'24-Jul-2020 12:00 AM',b'13-Jul-2020 01:00 PM',b'Supply of Material for GP DHANOLI Year 2020-2021/ PSMOUDA/DHANOLI/2020/21/114 / 2020_NAGPU_593899_1',b'Maharashtra',b'2020_NAGPU_593899_1'
b'34985.',b'14-Jul-2020 12:00 AM',b'13-Jul-2020 01:00 PM',b'SALE OF SUGAR/ NKD/Sugar Sale/47 / 2020_Coop_50493_1',b'Punjab',b'2020_Coop_50493_1'
b'34986.',b'07-Aug-2020 12:00 AM',b'13-Jul-2020 01:00 PM',"b'WORK OF CONSTRUCTION OF LT/11 KV LINE FOR RELEASING NEW CONNECTIONS AND ADDITIONAL LOAD AGAINST SANCTIONED PACKAGES UNDER THE JURISDICTION OF ELECTRICITY URBAN DISTRIBUTION DIVISION-I,  MORADABAD (IN DEPOSIT SCHEME).&amp;#x0d;\n&amp;#x0d;/ ST/05/EUDC(MBD)/2020-21 / 2020_PVVNL_492455_1'",b'Uttar Pradesh',b'2020_PVVNL_492455_1'
b'34987.',b'11-Aug-2020 12:00 AM',b'13-Jul-2020 01:00 PM',b'Construction of Kitchen and Dining of Premetric Girls I Hostel Agali  Palakkad/ KSNK/TECH/PLKD/AGKD-92(R)/2020 / 2020_KSNK_371492_1',b'Kerala',b'2020_KSNK_371492_1'
b'34988.',b'27-Jul-2020 12:00 AM',b'13-Jul-2020 01:00 PM',b'SALE OF SUGAR/ 2020/07/10/NSRSUGAR/06 / 2020_Coop_50497_1',b'Punjab',b'2020_Coop_50497_1'
b'34989.',b'13-Oct-2020 12:00 AM',b'13-Jul-2020 01:00 PM',"b'Construction of toilet block stage,chain link fencing and approach C C road to Agarkar high school building  at Akola Dist. Akola/ E-Tender Notice No.01/2020-21 / 2020_AKOLA_593902_1'",b'Maharashtra',b'2020_AKOLA_593902_1'
b'34990.',b'30-Oct-2020 12:00 AM',b'13-Jul-2020 01:00 PM',"b'Construction of shed near Community center Dayanand colony, ward no.8 under MCG./ EE-II/MCG/2020/19307 / 2020_HRY_134214_2'",b'Haryana',b'2020_HRY_134214_2'
b'34971.',b'13-Aug-2020 12:00 AM',b'13-Jul-2020 02:00 PM',b'Covid 19 Prevention/ Covid 19-933/A4/2020 / 2020_DoTE_171138_1',b'Tamil Nadu',b'2020_DoTE_171138_1'
b'34972.',b'30-Nov-2020 12:00 AM',b'13-Jul-2020 02:00 PM',"b'Construction of 1 No. shed in Gaushalla Village Phoosgarh, Ward No.2, Karnal/ 6/7 / 2020_HRY_135301_2'",b'Haryana',b'2020_HRY_135301_2'
b'34973.',b'07-Dec-2020 12:00 AM',b'13-Jul-2020 01:35 PM',b'CONSTRUCTION OF PARK INFRONT OF KARWALA  AT WARD 01/ 2020/UAD/1355/GOHAD / 2020_UAD_97746_1',b'Madhya Pradesh',b'2020_UAD_97746_1'
b'34974.',b'26-Aug-2020 12:00 AM',b'13-Jul-2020 01:30 PM',b'Construction of Rangmanch in Nadawan and Surajpura karela barmani Block Badwara/ 02/RES/2020 Date 04/07/2020 / 2020_RES_96330_1',b'Madhya Pradesh',b'2020_RES_96330_1'
b'34975.',b'24-Jul-2020 12:00 AM',b'13-Jul-2020 01:30 PM',b'Construction of Post mortem Room Barhi Block Badwara katni/ 02/RES/2020/Date 04/07/2020 / 2020_RES_96321_1',b'Madhya Pradesh',b'2020_RES_96321_1'
b'34976.',b'19-Oct-2020 12:00 AM',b'13-Jul-2020 01:30 PM',b'Construction of Ailamara RCC Bridge aproach road on the way of Sabroom to Baisnabpur road at ch 6.50km during the year 2020 2021 SH GSB WBM II and III carpeting sand seal coat  and CC block and pucca drain etc/ 05/PNIeT/EE/PWD/SBM/2020-21 / 2020_CEPWD_11018_1',b'Tripura',b'2020_CEPWD_11018_1'
b'34977.',b'11-Sep-2020 12:00 AM',b'13-Jul-2020 01:30 PM',b'CONSTRUCTION OF U SHAPE DRAIN FROM WELDING PULIYA TOWARDS SDM OFFICE TO TEEN KHAN KI MORI PULIYA AT WARD 16/ 2020/UAD/1355/GOHAD / 2020_UAD_97737_1',b'Madhya Pradesh',b'2020_UAD_97737_1'
b'34978.',b'30-Jul-2020 05:01 PM',b'13-Jul-2020 01:19 PM',"b'Supply Delivery and installation  of  (16) nos Pre-fabricated Modular Male and Female Toilets at ward 106 in Serilingampally  DIV20 in SLP Zone, GHMC(Item 3)/ 16/EE/CIR-20/SLPZ/GHMC/1-3/2020-21 Dt:10.07.2020 / 184937'",b'Telegana',b'184937'
b'34979.',b'21-Oct-2020 12:00 AM',b'13-Jul-2020 01:15 PM',b'CMLRRP (Phase II) Thiruvananthapuram District Attingal Legislative 2020-21 Cherunniyoor Grama Panchayath Rennovation of Cutting Thannimoodu Kattadivila Road&amp;#x0d;/ NO2/AE/LSGD/CHR/10/2020-21 / 2020_LSGD_364131_5',b'Kerala',b'2020_LSGD_364131_5'
b'34980.',b'29-Sep-2020 12:00 AM',b'13-Jul-2020 01:15 PM',b'Repairs to Agarkar high school building ( 15 Rooms)  at Akola  Dist. Akola/ E-Tender Notice No.01/2020-21 / 2020_AKOLA_593918_1',b'Maharashtra',b'2020_AKOLA_593918_1'
b'34961.',b'25-Jul-2020 03:26 PM',b'13-Jul-2020 02:34 PM',"b'Dismantling and re-erection of 17nos. of Mini Mast / Modern lighting poles at various locations in various divisions of Santosh Nagar Circle-7 in Yakutpura constituency/ NIT. No: 12/EE (Elect.)CMRZ/GHMC/AET/2020-21, Item No: 4, dated: 13-07-2020 / 184957'",b'Telegana',b'184957'
b'34962.',b'27-Aug-2020 12:00 AM',b'13-Jul-2020 02:30 PM',"b'Procurement, supply, Installation and Commissioning of Two CNC Machines/ PAC/IND/2020-21/ 31 / 2020_MPSID_97654_1'",b'Madhya Pradesh',b'2020_MPSID_97654_1'
b'34963.',b'14-Jul-2020 12:00 AM',b'13-Jul-2020 02:30 PM',b'SALE OF SUGAR/ 314 / 2020_Coop_50507_1',b'Punjab',b'2020_Coop_50507_1'
b'34964.',b'25-Jul-2020 02:54 PM',b'13-Jul-2020 02:24 PM',"b'Supply of LT AB cable in place of damaged and brount out of AB cable at various locations in various divisions of Santosh Nagar Circle-7 in Yakutpura Constituency/ NIT. No: 12/EE (Elect.)CMRZ/GHMC/AET/2020-21, Item No: 3, dated: 13-07-2020 / 184955'",b'Telegana',b'184955'
b'34965.',b'29-Sep-2020 12:00 AM',b'13-Jul-2020 02:20 PM',b'SH Construction of approach road  SH Retaining Wall Earth filling  Metalling Carpetting  Block pitching Pucca Drain Etc/ 05/PNIeT/EE/PWD/SBM/2020-21 / 2020_CEPWD_11319_1',b'Tripura',b'2020_CEPWD_11319_1'
b'34966.',b'27-Jul-2020 02:08 PM',b'13-Jul-2020 02:17 PM',"b'Providing of 4 nos. of 9 mtrs MS tubular poles at Quarters of Central Prison, Chanchalguda Jail in Chawni division Malakpet Circle -6 and Constituency/ NIT. No: 12/EE (Elect.)CMRZ/GHMC/AET/2020-21, Item No: 2, dated: 13-07-2020 / 184953'",b'Telegana',b'184953'
b'34967.',b'13-Aug-2020 12:00 AM',b'13-Jul-2020 02:00 PM',b'Covid 19 Prevention/ Covid 19-933/A4/2020 / 2020_DoTE_171138_1',b'Tamil Nadu',b'2020_DoTE_171138_1'
b'34968.',b'19-Nov-2020 12:00 AM',b'13-Jul-2020 02:00 PM',"b'CONSTRUCTION WORK OF C.C. ROAD AND BOX CULVERT OF 4000 MT GODOWN OF MARKFED AT DHATURIA, DISTT. VIDISHA. 1st Call./ MPSCMFL_ENGG 813 / 2020_SCMFL_97723_1'",b'Madhya Pradesh',b'2020_SCMFL_97723_1'
b'34969.',b'08-Sep-2020 12:00 AM',b'13-Jul-2020 02:00 PM',b'Deposite work jalanidhi Thennala GP.restoration work in Venniyoor Paramba  Tanur road km 0/190 to 2/600  in Tirurangadi LAC/ D5/RD/2019/ 4611 / 2020_PWD_371486_1',b'Kerala',b'2020_PWD_371486_1'
b'34970.',b'24-Jul-2020 12:00 AM',b'13-Jul-2020 02:00 PM',b'PROVIDING CONCRETE PAVERS AT BHIM NAGAR/ eTENDER/HIWARASANGAM/2020-21/1 / 2020_YAVAT_593922_1',b'Maharashtra',b'2020_YAVAT_593922_1'
b'34951.',b'22-Oct-2020 12:00 AM',b'13-Jul-2020 03:00 PM',"b'Const. of Building of Govt. College for women, Ambala City (Pdg. 3D Hologram, Virtual reality based educational modules for post graduate colleges)./ PWD/Elect-KNL/Elect-AMB/100004 / 2020_HRY_135424_1'",b'Haryana',b'2020_HRY_135424_1'
b'34952.',b'19-Aug-2020 12:00 AM',b'13-Jul-2020 03:00 PM',b'Providing LED Street Light At-Upalwate Tal-Madha Dist-Solapur/ 01/2020-21 / 2020_SOLAP_593964_1',b'Maharashtra',b'2020_SOLAP_593964_1'
b'34953.',b'19-Aug-2020 12:00 AM',b'13-Jul-2020 03:00 PM',b'Sidhan village laying of pipe line and FHTC connection/ No. 6740-6796 dt. 07/07/2020 / 2020_HRY_135436_1',b'Haryana',b'2020_HRY_135436_1'
b'34954.',b'24-Jul-2020 12:00 AM',b'13-Jul-2020 03:00 PM',b'Civil Work/ D.P.D.C.2019-2020 / 2020_BEED_593384_1',b'Maharashtra',b'2020_BEED_593384_1'
b'34955.',b'16-Sep-2020 12:00 AM',b'13-Jul-2020 03:00 PM',"b'Pattambi LAC-ADS 2019-20, Various Roads in Kulukkalloor GP (High School Madrassa Road, Mullathupadi Valiya Parambu Road Side Protection And Concreting)&amp;#x0d;/ 98/E/20-21 / 2020_LSGD_371113_1'",b'Kerala',b'2020_LSGD_371113_1'
b'34956.',b'20-Oct-2020 12:00 AM',b'13-Jul-2020 03:00 PM',b'LAC ADS 2019-20- TARUR- CONSTRUCTION OF P.H.C. BUILDING IN  KANNAMBRA G.P./ 31/E/20-21 / 2020_LSGD_362440_2',b'Kerala',b'2020_LSGD_362440_2'
b'34957.',b'30-Dec-2020 12:00 AM',b'13-Jul-2020 03:00 PM',b'con.cc road cc rineval coat pevar block laying ward 15 parasri pul to manas bhavan/ 3029 / 2020_UAD_97762_1',b'Madhya Pradesh',b'2020_UAD_97762_1'
b'34958.',b'09-Oct-2020 12:00 AM',b'13-Jul-2020 03:00 PM',b'ADS MLA 2019-20 -Nenmara LAC-Construction of Buildig for Challa GLP School in Muthalamada  GP&amp;#x0d;/ 101/E/20-21 / 2020_LSGD_371130_1',b'Kerala',b'2020_LSGD_371130_1'
b'34959.',b'25-Jul-2020 03:32 PM',b'13-Jul-2020 02:55 PM',"b'Providing of 20nos of 9 mtrs semi masts of MS tubular poles at various places in Barkas division(42) of Chandrayangutta Circle-8 and Constituency/ NIT. No: 12/EE (Elect.)CMRZ/GHMC/AET/2020-21, Item No: 6, dated: 13-07-2020 / 184962'",b'Telegana',b'184962'
b'34960.',b'25-Jul-2020 03:29 PM',b'13-Jul-2020 02:46 PM',"b'Dismantling  Re-erection of 2nos of 20mtrs Masts, 16nos of MS poles and providing of 5nos of new MS poles at various locations of various divisions of Chandrayangutta Circle-8 and Constituency/ NIT. No: 12/EE (Elect.)CMRZ/GHMC/AET/2020-21, Item No: 5, dated: 13-07-2020 / 184960'",b'Telegana',b'184960'
b'34941.',b'19-Aug-2020 12:00 AM',b'13-Jul-2020 03:00 PM',b'Dariyapur laying of pipe line and FHTC connection/ No. 6740-6796 dt. 07/07/2020 / 2020_HRY_135409_1',b'Haryana',b'2020_HRY_135409_1'
b'34942.',b'21-Aug-2020 12:00 AM',b'13-Jul-2020 03:00 PM',b'Providing  01 Nos. hiring for Commercial Vehicle i.e. TATA 407 or equivelent vehicle of latest modal maximum Two year old  City Dn Rewa/ 4285 / 2020_PKVVC_97736_1',b'Madhya Pradesh',b'2020_PKVVC_97736_1'
b'34943.',b'24-Aug-2020 12:00 AM',b'13-Jul-2020 03:00 PM',"b'LAC-ADS 2019-20, Alathur Court Compound -Construction of Janasevana Kendram (Re freshment Hall,Client sevana kendram),Alathur Gramapanchayath.&amp;#x0d;/ 100/E/20-21 / 2020_LSGD_371055_1'",b'Kerala',b'2020_LSGD_371055_1'
b'34944.',b'09-Oct-2020 12:00 AM',b'13-Jul-2020 03:00 PM',b'ADS MLA 2019-20 -Nenmara LAC-Construction of Buildig for Challa GLP School in Muthalamada  GP&amp;#x0d;/ 101/E/20-21 / 2020_LSGD_371130_1',b'Kerala',b'2020_LSGD_371130_1'
b'34945.',b'24-Sep-2020 12:00 AM',b'13-Jul-2020 03:00 PM',"b'STBT TO BABHULGAON TO MALIWADGAON ROAD, VR-12, KM. 1/500 TO 2/700, TQ. GANGAPUR./ ZPA/WORKS/5054/13/7/20 / 2020_AURAN_593976_2'",b'Maharashtra',b'2020_AURAN_593976_2'
b'34946.',b'31-Jul-2020 12:00 AM',b'13-Jul-2020 03:00 PM',"b'10 Nos. LED Semi High Mast Light at Block Ram Nagar, Bareilly (Vidhayak Nidhi)/ 135-3/E.E.E Bly/E-Tender/BLY/2020-21 Dt 13.07.2020 / 2020_SCIDC_492525_1'",b'Uttar Pradesh',b'2020_SCIDC_492525_1'
b'34947.',b'21-Jul-2020 12:00 AM',b'13-Jul-2020 03:00 PM',b'Constructing Anganwadi Building At.Devarpade Tal.Malegaon Dist.Nashik/ E-TENDER NOTICE NO. 01/2019-20 / 2020_NASHI_593112_1',b'Maharashtra',b'2020_NASHI_593112_1'
b'34948.',b'20-Oct-2020 12:00 AM',b'13-Jul-2020 03:00 PM',b'LAC ADS 2019-20- TARUR- CONSTRUCTION OF P.H.C. BUILDING IN  KANNAMBRA G.P./ 31/E/20-21 / 2020_LSGD_362440_2',b'Kerala',b'2020_LSGD_362440_2'
b'34949.',b'24-Jul-2020 12:00 AM',b'13-Jul-2020 03:00 PM',b'Civil Work/ D.P.D.C.2019-2020 / 2020_BEED_593384_1',b'Maharashtra',b'2020_BEED_593384_1'
b'34950.',b'30-Dec-2020 12:00 AM',b'13-Jul-2020 03:00 PM',b'con.cc road cc rineval coat pevar block laying ward 15 parasri pul to manas bhavan/ 3029 / 2020_UAD_97762_1',b'Madhya Pradesh',b'2020_UAD_97762_1'
b'34931.',b'31-Jul-2020 12:28 AM',b'13-Jul-2020 03:50 PM',"b'Repairs  Renovations to Bastidawakhana at Dr.B.R. Ambedkar Bhavan, Bandi-Ki-Adda, Ghansibazar-49, Chandrayangutta, Hyderabad/ 6-3/EE/TSMSIDC/Hyd.Divn/2020-21/           Dt:  09.07.2020 / 184976'",b'Telegana',b'184976'
b'34932.',b'25-Jul-2020 03:58 PM',b'13-Jul-2020 03:45 PM',"b'Dismantling and re-erection of 9 nos. of modern lighting poles at 1) Durga Nagar Road 2) NPA Road 3) Hyderguda Road and 4) Suleman Nagar Road in Rajendra Nagar Circle-11 and Constituency/ NIT. No: 12/EE (Elect.)CMRZ/GHMC/AET/2020-21, Item No: 8, dated: 13-07-2020 / 184970'",b'Telegana',b'184970'
b'34933.',b'31-Jul-2020 12:26 AM',b'13-Jul-2020 03:43 PM',"b'Repairs  Renovations to Bastidawakhana at Jama Masjid Sarwar-E-Kaoniam (SAW) Fateh Shah Nagar, Lalithabagh-36, Chandrayangutta, Hyderabad/ 6-2/EE/TSMSIDC/Hyd.Divn/2020-21/           Dt:  09.07.2020 / 184973'",b'Telegana',b'184973'
b'34934.',b'31-Jul-2020 12:23 AM',b'13-Jul-2020 03:37 PM',"b'Repairs  Renovations to Bastidawakhana at Majid-E-Omer Farooq C Block, Kanchanbagh-41, Chandrayangutta, Hyderabad/ 6-1/EE/TSMSIDC/Hyd.Divn/2020-21/       Dt: 09.07.2020 / 184969'",b'Telegana',b'184969'
b'34935.',b'22-Oct-2020 12:00 AM',b'13-Jul-2020 03:30 PM',"b'Const. of Govt. College at Bilaspur (Aharwala) in Yamuna Nagar District. (Pdg. Generator Set) (Pdg. 3D Hologram, Virtual reality based educational modules for post graduate colleges)./ PWD/Elect-KNL/Elect-AMB/100005 / 2020_HRY_135437_1'",b'Haryana',b'2020_HRY_135437_1'
b'34936.',b'18-Aug-2020 12:00 AM',b'13-Jul-2020 03:30 PM',b'CONST.OF C.C ROAD AT PRINCE COLONY AND 3 NO.&amp;#x0d;\nAPPROCH ROAD ANKUR APPARTMENT ROAD AT WARD&amp;#x0d;\nNO.10 Z-02&amp;#x0d;/ 2019205312 / 2020_UAD_81070_3',b'Madhya Pradesh',b'2020_UAD_81070_3'
b'34937.',b'09-Sep-2020 12:00 AM',b'13-Jul-2020 03:30 PM',b'PARWALA Providing Functional Household Tap Connection FHTC under Jal Jeevan Mission. Laying of D.I Pipe line in balance streets and providing Functional Household Tap Connection FHTC in village PARWALA  and all other works contingent thereto./ Laying of D.I Pipe line under JJM Parwala / 2020_HRY_135421_1',b'Haryana',b'2020_HRY_135421_1'
b'34938.',b'18-Aug-2020 12:00 AM',b'13-Jul-2020 03:30 PM',b'Const. of cc road and nalla from saleem house to main road&amp;#x0d;\nPGBT W-13 Z-03&amp;#x0d;/ 2019202533 / 2020_UAD_81073_3',b'Madhya Pradesh',b'2020_UAD_81073_3'
b'34939.',b'14-Jul-2020 12:00 AM',b'13-Jul-2020 03:15 PM',b'Sale of Sugar On Per Qtl. Basis/ GSP/Sale of Sugar/20-21/61 / 2020_Coop_50512_1',b'Punjab',b'2020_Coop_50512_1'
b'34940.',b'25-Jul-2020 03:51 PM',b'13-Jul-2020 03:10 PM',"b'Dismantling and re-erection 16 nos. of side modern lighting poles at various places in Puranapool division division (52) in Charminar Circle-9 and Constituency/ NIT. No: 12/EE (Elect.)CMRZ/GHMC/AET/2020-21, Item No: 7, dated: 13-07-2020 / 184965'",b'Telegana',b'184965'
b'34921.',b'12-Oct-2020 12:00 AM',b'13-Jul-2020 04:00 PM',b'PROPOSED CONSTRUCTION OF C C ROAD FROM AGNIHOTRI HOUSE TO BALU DAHALE HOUSE IN PRABHAG NO 3 FOR M C PARLI VAIJNATH DIST BEED/ civil department (20) 2020-21 for M C Parli V / 2020_DMA_593610_1',b'Maharashtra',b'2020_DMA_593610_1'
b'34922.',b'04-Sep-2020 12:00 AM',b'13-Jul-2020 04:00 PM',b'Complete Repairs And Maintaince Of Radial Gate Of Size 12X 4 Mtr and its hoist assembly 20 Ton cap - 3Nos by repairing to water lubrication and by pass system and replacing rubber seal air vent pipe system stair case etc at Chikotra project Tal ajara/ E Tender Notic No.7 for 20-21 / 2020_WRDMN_593986_1',b'Maharashtra',b'2020_WRDMN_593986_1'
b'34923.',b'29-Dec-2020 12:00 AM',b'13-Jul-2020 04:00 PM',b'Ownfund/ 27/ME/PMNA/2020-21 / 2020_LSGD_371531_1',b'Kerala',b'2020_LSGD_371531_1'
b'34924.',b'29-Jul-2020 12:00 AM',b'13-Jul-2020 04:00 PM',b'Improvement of Road from Kumarpur Dulal Mandal house to Alanath Mandal House/ 12/SKGP/2020-21 / 2020_ZPHD_289356_1',b'West Bengal',b'2020_ZPHD_289356_1'
b'34925.',b'01-Oct-2020 12:00 AM',b'13-Jul-2020 04:00 PM',"b'Laying of DI pipe line in balance streets, Providing functional Household tap connation (FHTC) in village Dhakwala and all other works contingent thereto/ SE, PHEC, Karnal Memo No. 8081 dt. 23.06.2020 / 2020_HRY_133315_3'",b'Haryana',b'2020_HRY_133315_3'
b'34926.',b'03-Dec-2020 12:00 AM',b'13-Jul-2020 04:00 PM',b'PROPOSED CONSTRUCTION OF C C ROAD IN SURVEY NO 57 IN FRON OF CHAURE HOUSE IN PRABHAG NO 9 FOR M C PARLI VAIJNATH DIST BEED/ civil department (20) 2020-21 for M C Parli V / 2020_DMA_593753_1',b'Maharashtra',b'2020_DMA_593753_1'
b'34927.',b'09-Oct-2020 12:00 AM',b'13-Jul-2020 04:00 PM',"b'RENOVATION AND SPECIAL REPAIR WITH ARCHITECTURAL DEVELOPMENT OF DHEU TOURIST LODGE COMPLEX INCLUDING GENERATOR HOUSE OF BENFISH AT PURI, ORISSA/ BENFISH/MD/NIT- 20(e)/2019-20 (3rd Call) / 2020_BENF_289430_1'",b'West Bengal',b'2020_BENF_289430_1'
b'34928.',b'03-Dec-2020 12:00 AM',b'13-Jul-2020 04:00 PM',b'PROPOSED CONSTRUCTION OF C C ROAD FROM THORAT HOUSE TO U IN PRABHAG NO 9 FOR M C PARLI VAIJNATH DIST BEED/ civil department (20) 2020-21 for M C Parli V / 2020_DMA_593657_1',b'Maharashtra',b'2020_DMA_593657_1'
b'34929.',b'31-Jul-2020 12:31 AM',b'13-Jul-2020 03:58 PM',"b'Repairs  Renovations to Bastidawakhana at Kummariwadi, Shalibanda-48, Charminar, Hyderabad/ 6-4/EE/TSMSIDC/Hyd.Divn/2020-21/           Dt:  09.07.2020 / 184978'",b'Telegana',b'184978'
b'34930.',b'27-Jul-2020 01:53 PM',b'13-Jul-2020 03:55 PM',"b'Providing of 35 nos. PSCC poles (Only) at Upparpalli, Sai Bhavani Colony, Golden Hights colony near Maha Laxmi Apartment road and other locations in Rajendra Nagar division (60) of Rajendra Nagar Circle -11 and Constituency/ NIT. No: 12/EE (Elect.)CMRZ/GHMC/AET/2020-21, Item No: 9, dated: 13-07-2020 / 184977'",b'Telegana',b'184977'
b'34901.',b'15-Oct-2020 12:00 AM',b'13-Jul-2020 04:00 PM',"b'Drilling of 28 Nos, 150/125/115mm dia 90m deep tubewells With installation of hand pump and construction of platforms in different Villages for creation of Tubewell source in Ashok Nagar Block/ NO 22  /EE/PHED/2020-21/Ashok Nagar 13.07.2020 / 2020_PHED_97694_1'",b'Madhya Pradesh',b'2020_PHED_97694_1'
b'34902.',b'30-Dec-2020 12:00 AM',b'13-Jul-2020 04:00 PM',b'PROPOSED CONSTRUCTION OF C C ROAD IN SURVEY NO 57 IN FRONT KEDAR HOUSE TO JAYRAM HOUSE I N PRABHAG NO 9 FOR M C PARLI VAIJNATH DIST BEED/ civil department (20) 2020-21 for M C Parli V / 2020_DMA_593737_1',b'Maharashtra',b'2020_DMA_593737_1'
b'34903.',b'03-Dec-2020 12:00 AM',b'13-Jul-2020 04:00 PM',b'PROPOSED CONSTRUCTION OF C C ROAD FROM O TO P IN PRABHAG NO 9 FOR M C PARLI VAIJNATH DIST BEED/ civil department (20) 2020-21 for M C Parli V / 2020_DMA_593661_1',b'Maharashtra',b'2020_DMA_593661_1'
b'34904.',b'01-Oct-2020 12:00 AM',b'13-Jul-2020 04:00 PM',"b'Laying of DI pipe line in balance streets, Providing functional Household tap connation (FHTC) in village Dhakwala and all other works contingent thereto/ SE, PHEC, Karnal Memo No. 8081 dt. 23.06.2020 / 2020_HRY_133315_3'",b'Haryana',b'2020_HRY_133315_3'
b'34905.',b'25-Sep-2020 12:00 AM',b'13-Jul-2020 04:00 PM',b'architect and project management consaltancy work for Parli Vaijnath Joyotirling Vikas Arakhada for Parli Vaijnath Municipal Council/ civil department (12/1) 19-20 for MC  Parli V / 2020_DMA_593865_1',b'Maharashtra',b'2020_DMA_593865_1'
b'34906.',b'03-Sep-2020 12:00 AM',b'13-Jul-2020 04:00 PM',"b'Laying of D.I. Pipeline in balance streets and providing Functional Households Tap Connection and repair of pump chamber in village Mukhala and all other works contingent thereto/ SE, PHEC, Karnal Memo No. 8369 dt. 29.06.2020 / 2020_HRY_134149_2'",b'Haryana',b'2020_HRY_134149_2'
b'34907.',b'04-Sep-2020 12:00 AM',b'13-Jul-2020 04:00 PM',b'Construction of 5 posts outside the barracks in Distt. Jail Kurukshetra/ 2020/HPHC/JULY-12/ 001 / 2020_HBC_135445_1',b'Haryana',b'2020_HBC_135445_1'
b'34908.',b'03-Dec-2020 12:00 AM',b'13-Jul-2020 04:00 PM',b'PROPOSED CONSTRUCTION OF C C ROAD IN SURVEY NO 57 IN FRONT OF MUNDE HOUSE IN PRABHAG NO 9 FOR M C PARLI VAIJNATH DIST BEED/ civil department (20) 2020-21 for M C Parli V / 2020_DMA_593760_1',b'Maharashtra',b'2020_DMA_593760_1'
b'34909.',b'03-Dec-2020 12:00 AM',b'13-Jul-2020 04:00 PM',b'PROPOSED CONSTRUCTION OF C C ROAD IN SURVEY NO 57 IN FRONT OF BURKUTE HOUSE IN PRABHAG NO 9 FOR M C PARLI VAIJNATH DIST BEED/ civil department (20) 2020-21 for M C Parli V / 2020_DMA_593683_1',b'Maharashtra',b'2020_DMA_593683_1'
b'34910.',b'01-Sep-2020 12:00 AM',b'13-Jul-2020 04:00 PM',"b'Laying of D.I. Pipeline in balance streets and providing Functional Households Tap Connection in village Mukhali and all other works contingent thereto/ SE, PHEC, Karnal Memo No. 8367 dt. 29.06.2020 / 2020_HRY_134104_2'",b'Haryana',b'2020_HRY_134104_2'
b'34891.',b'08-Sep-2020 12:00 AM',b'13-Jul-2020 04:00 PM',"b'Laying of D.I. Pipeline in balance streets and providing Functional Households Tap Connection and repair of pump chamber in village Taprion and all other works contingent thereto/ SE, PHEC, Karnal Memo No. 8363 dt. 29.06.2020 / 2020_HRY_134142_2'",b'Haryana',b'2020_HRY_134142_2'
b'34892.',b'03-Dec-2020 12:00 AM',b'13-Jul-2020 04:00 PM',b'PROPOSED CONSTRUCTION OF C C ROAD IN SURVEY NO 57 IN FRONT SHINDE HOUSE IN PRABHAG NO 9 FOR M C PARLI VAIJNATH DIST BEED/ civil department (20) 2020-21 for M C Parli V / 2020_DMA_593686_1',b'Maharashtra',b'2020_DMA_593686_1'
b'34893.',b'03-Dec-2020 12:00 AM',b'13-Jul-2020 04:00 PM',b'PROPOSED CONSTRUCTION OF C C ROAD FROM JOGDAND HOUSE TO PHUNDEBAI HOUSE IN PRABHAG NO 9 FOR M C PARLI VAIJNATH DIST BEED/ civil department (20) 2020-21 for M C Parli V / 2020_DMA_593663_1',b'Maharashtra',b'2020_DMA_593663_1'
b'34894.',b'03-Dec-2020 12:00 AM',b'13-Jul-2020 04:00 PM',b'PROPOSED CONSTRUCTION OF C C ROAD AND C C DRAIN FROM R TO Q IN PRABHAG NO 9 FOR M C PARLI VAIJNATH DIST BEED/ civil department (20) 2020-21 for M C Parli V / 2020_DMA_593634_1',b'Maharashtra',b'2020_DMA_593634_1'
b'34895.',b'04-Sep-2020 12:00 AM',b'13-Jul-2020 04:00 PM',b'Complete Repairs And Maintaince Of Radial Gate Of Size 12X 4 Mtr and its hoist assembly 20 Ton cap - 3Nos by repairing to water lubrication and by pass system and replacing rubber seal air vent pipe system stair case etc at Chikotra project Tal ajara/ E Tender Notic No.7 for 20-21 / 2020_WRDMN_593986_1',b'Maharashtra',b'2020_WRDMN_593986_1'
b'34896.',b'16-Sep-2020 12:00 AM',b'13-Jul-2020 04:00 PM',b'Construction of Sanskrutik Bhavan at  Kudal Tal Jawali Dist Satara./ KU/7/2019-20 / 2020_SATAR_593981_1',b'Maharashtra',b'2020_SATAR_593981_1'
b'34897.',b'03-Sep-2020 12:00 AM',b'13-Jul-2020 04:00 PM',"b'Laying of D.I. pipeline in balance streets and providing functional Household tap connation in village Chhaprian and all other works contingent thereto/ SE, PHEC, Karnal Memo No. 8364 dt. 29.06.2020 / 2020_HRY_134151_2'",b'Haryana',b'2020_HRY_134151_2'
b'34898.',b'24-Dec-2020 12:00 AM',b'13-Jul-2020 04:00 PM',b'Construction of two storied with three storied foundation Boys Hostel at Champagachi High School in Rajarhat Block in the district of North 24 Parganas. 2nd Call. Retender./ WBPWD/SE/SC_SS/NIT01_2nd Call/2020-2021 / 2020_WBPWD_289437_1',b'West Bengal',b'2020_WBPWD_289437_1'
